,id,published,title,summary
0,https://www.lemonde.fr/disparitions/article/2022/09/08/la-reine-elizabeth-ii-etait-la-plus-ancienne-cheffe-d-etat-du-monde_6140789_3382.html,"Thu, 08 Sep 2022 19:46:48 +0200",La reine Elizabeth II était la plus ancienne cheffe d’Etat du monde,"Arrivée sur le trône au temps des trains à vapeur et du mariage à vie, la reine, morte le 8  à l’âge de 96 ans, aura voyagé en supersonique et connu le divorce de trois de ses enfants."
1,https://www.lemonde.fr/disparitions/article/2022/09/08/la-reine-elizabeth-ii-est-morte-apres-soixante-dix-ans-d-un-regne-hors-du-commun_6140784_3382.html,"Thu, 08 Sep 2022 19:36:59 +0200","La reine Elizabeth II est morte, après soixante-dix ans d’un  règne hors du commun","La monarque, qui avait accédé au trône en 1952 à l’âge de 26 ans, est morte le 8 septembre à 96 ans. Souveraine impassible, vénérée par le peuple britannique, cheffe des armées, gouverneure suprême de l’Eglise anglicane, interlocutrice de quinze premiers ministres britanniques, elle laisse une empreinte durable sur la monarchie."
2,https://www.lemonde.fr/disparitions/article/2022/09/08/la-mort-de-louis-fabrice-latour-figure-des-vins-de-bourgogne_6140761_3382.html,"Thu, 08 Sep 2022 17:39:25 +0200","La mort de Louis-Fabrice Latour, figure des vins de Bourgogne","Depuis 1999, il présidait aux destinées de la maison de négoce beaunoise Louis Latour, fondée au XVIIIe siècle. Il s’est éteint dans la nuit du 5 au 6 septembre, à l’âge de 58 ans."
3,https://www.lemonde.fr/disparitions/article/2022/09/08/la-mort-de-serge-bolloch-ancien-journaliste-au-monde_6140738_3382.html,"Thu, 08 Sep 2022 15:49:36 +0200","La mort de Serge Bolloch, ancien journaliste au « Monde »","Rédacteur pendant près de trente ans au quotidien du soir, il avait suivi l’actualité de l’enseignement supérieur, le sport et l’information régionale, participant notamment à la création du « Monde Rhône-Alpes ». Il s’est éteint le 4 septembre, à l’âge de 77 ans."
4,https://www.lemonde.fr/disparitions/article/2022/09/08/la-mort-de-just-jaeckin-cineaste-de-l-hedonisme-des-annees-1970_6140681_3382.html,"Thu, 08 Sep 2022 09:42:23 +0200","La mort de Just Jaeckin, cinéaste de l’hédonisme des années 1970","Le réalisateur a connu la célébrité dès son premier film, « Emmanuelle », un succès réitéré avec « Histoire d’O ». Egalement photographe et sculpteur, il est mort le 6 septembre, à l’âge de 82 ans."
5,https://www.lemonde.fr/disparitions/article/2022/09/07/la-mort-du-pianiste-et-chef-d-orchestre-allemand-lars-vogt_6140545_3382.html,"Wed, 07 Sep 2022 11:42:21 +0200",La mort du pianiste et chef d’orchestre allemand Lars Vogt,"Directeur musical de l’Orchestre de chambre de Paris depuis 2020, le musicien, diagnostiqué en mars 2021 d’un cancer du foie inopérable, s’est éteint le 5 septembre à Erlangen, à l’âge de 51 ans"
6,https://www.lemonde.fr/disparitions/article/2022/09/07/just-jaeckin-le-realisateur-d-emmanuelle-est-mort-a-l-age-de-82-ans_6140518_3382.html,"Wed, 07 Sep 2022 10:03:59 +0200","Just Jaeckin, le réalisateur d’« Emmanuelle », est mort à l’âge de 82 ans","Le film, qui a connu un succès international, du Japon aux Etats-Unis, raconte les aventures sexuelles d’une jeune femme en Asie. Just Jaeckin réalisera ensuite « Histoire d’O » et, à nouveau avec Sylvia Kristel, « L’Amant de Lady Chatterley »."
7,https://www.lemonde.fr/culture/article/2022/09/06/regis-durand-en-quelques-dates_6140390_3246.html,"Tue, 06 Sep 2022 11:40:51 +0200",Régis Durand en quelques dates,
8,https://www.lemonde.fr/culture/article/2022/09/06/la-mort-de-regis-durand-defenseur-de-l-image-contemporaine_6140389_3246.html,"Tue, 06 Sep 2022 11:40:07 +0200","La mort de Régis Durand, défenseur de l’image contemporaine","Le critique d’art et commissaire d’exposition, qui fut le premier directeur du Jeu de paume, lieu consacré à la photographie, est mort le 25 août, à l’âge de 80 ans"
9,https://www.lemonde.fr/disparitions/article/2022/09/06/la-mort-de-kazuo-inamori-industriel-japonais-et-moine-bouddhiste_6140357_3382.html,"Tue, 06 Sep 2022 08:57:51 +0200","La mort de Kazuo Inamori, industriel japonais et moine bouddhiste","Grand patron né dans une famille modeste, philanthrope et non conformiste, il fit de Kyoto Ceramic un fleuron de l’industrie nippone, avant de voler à la rescousse de Japan Airlines. Il s’est éteint le 24 août 2002, à l’âge de 90 ans."
10,https://www.lemonde.fr/disparitions/article/2022/08/31/mort-de-mikhail-gorbatchev-macron-salue-un-homme-de-paix-poutine-en-reste-a-de-profondes-condoleances_6139567_3382.html,"Wed, 31 Aug 2022 01:45:13 +0200","Mort de Mikhaïl Gorbatchev : Emmanuel Macron salue un « homme de paix », Vladimir Poutine « un homme d’Etat qui a eu une grande influence sur l’évolution de l’histoire du monde »","Les premières réactions internationales à la disparition du père de la perestroïka saluent « l’engagement », le « courage » et le « rôle crucial » d’un homme qui a contribué à mettre fin à la guerre froide."
11,https://www.lemonde.fr/disparitions/article/2022/08/30/mikhail-gorbatchev-le-dernier-dirigeant-de-l-urss-est-mort_6139559_3382.html,"Tue, 30 Aug 2022 22:47:54 +0200","Mikhaïl Gorbatchev, le dernier dirigeant de l’URSS, est mort","Artisan du rapprochement Est-Ouest, le père de la perestroïka s’est éteint à l’âge de 91 ans. Perçu en Russie comme le responsable du chaos qui a suivi la chute de l’Union soviétique, il avait quitté la vie politique en 1991."
12,https://www.lemonde.fr/disparitions/article/2022/08/30/camilo-guevara-march-fils-de-che-guevara-est-mort_6139550_3382.html,"Tue, 30 Aug 2022 19:45:35 +0200","Camilo Guevara March, fils d’Ernesto « Che » Guevara, est mort","Diplômé en droit du travail, l’ancien directeur du Centre d’études Che-Guevara à La Havane, une institution dédiée à la mémoire de l’œuvre et de la pensée du Che, est mort à l’âge de 60 ans."
