links,link,title,title_detail,summary,summary_detail,published,published_parsed,id,guidislink
"[{'rel': 'alternate', 'type': 'text/html', 'href': 'http://www.lemonde.fr/disparitions/article/2016/03/03/l-ancien-president-du-conseil-constitutionnel-yves-guena-est-mort_4875645_3382.html'}, {'type': 'image/jpeg', 'length': '21200', 'href': 'http://s1.lemde.fr/image/2016/03/03/644x322/4875644_3_28de_yves-guena-le-2-octobre-2006_6beb029aee343a684c87a62f14900e6e.jpg', 'rel': 'enclosure'}]",http://www.lemonde.fr/disparitions/article/2016/03/03/l-ancien-president-du-conseil-constitutionnel-yves-guena-est-mort_4875645_3382.html,"Mort d’Yves Guéna, figure du gaullisme","{'type': 'text/plain', 'language': None, 'base': 'http://web.archive.org/web/20160304062738/http://www.lemonde.fr/disparitions/rss_full.xml', 'value': 'Mort d’Yves Guéna, figure du gaullisme'}","Celui qui fut président du Conseil constitutionnel, sénateur de la Dordogne et maire de Périgueux s’est éteint dans la nuit de mercredi à jeudi à l’âge de 93 ans.","{'type': 'text/html', 'language': None, 'base': 'http://web.archive.org/web/20160304062738/http://www.lemonde.fr/disparitions/rss_full.xml', 'value': 'Celui qui fut président du Conseil constitutionnel, sénateur de la Dordogne et maire de Périgueux s’est éteint dans la nuit de mercredi à jeudi à l’âge de 93 ans.'}","Thu, 03 Mar 2016 10:32:34 +0100","time.struct_time(tm_year=2016, tm_mon=3, tm_mday=3, tm_hour=9, tm_min=32, tm_sec=34, tm_wday=3, tm_yday=63, tm_isdst=0)",http://www.lemonde.fr/tiny/4875645/,False
"[{'rel': 'alternate', 'type': 'text/html', 'href': 'http://www.lemonde.fr/disparitions/article/2016/03/01/l-acteur-oscarise-george-kennedy-est-mort_4874040_3382.html'}, {'type': 'image/jpeg', 'length': '33959', 'href': 'http://s2.lemde.fr/image/2016/03/01/644x322/4874622_3_ed44_l-acteur-george-kennedy-a-hollywood-en-mars_12cfe62aedd87f0babdd3ea1c79a62a4.jpg', 'rel': 'enclosure'}]",http://www.lemonde.fr/disparitions/article/2016/03/01/l-acteur-oscarise-george-kennedy-est-mort_4874040_3382.html,L’acteur oscarisé George Kennedy est mort,"{'type': 'text/plain', 'language': None, 'base': 'http://web.archive.org/web/20160304062738/http://www.lemonde.fr/disparitions/rss_full.xml', 'value': 'L’acteur oscarisé George Kennedy est mort'}","Connu du grand public pour ses apparitions dans la série des « Y-a-t-il un flic… ? », le comédien s’est éteint à l’âge de 91 ans.","{'type': 'text/html', 'language': None, 'base': 'http://web.archive.org/web/20160304062738/http://www.lemonde.fr/disparitions/rss_full.xml', 'value': 'Connu du grand public pour ses apparitions dans la série des «\xa0Y-a-t-il un flic…\xa0?\xa0», le comédien s’est éteint à l’âge de 91 ans.'}","Tue, 01 Mar 2016 02:48:55 +0100","time.struct_time(tm_year=2016, tm_mon=3, tm_mday=1, tm_hour=1, tm_min=48, tm_sec=55, tm_wday=1, tm_yday=61, tm_isdst=0)",http://www.lemonde.fr/tiny/4874040/,False
"[{'rel': 'alternate', 'type': 'text/html', 'href': 'http://www.lemonde.fr/disparitions/article/2016/02/28/mort-de-claude-parent-theoricien-de-l-architecture_4873247_3382.html'}, {'type': 'image/jpeg', 'length': '22519', 'href': 'http://s1.lemde.fr/image/2016/02/28/644x322/4873246_3_ecca_l-architecte-inventeur-avec-paul-virilio-de-l_3765ebee4a097410e6c3111e8503ea32.jpg', 'rel': 'enclosure'}]",http://www.lemonde.fr/disparitions/article/2016/02/28/mort-de-claude-parent-theoricien-de-l-architecture_4873247_3382.html,"Mort de Claude Parent, théoricien de l’architecture","{'type': 'text/plain', 'language': None, 'base': 'http://web.archive.org/web/20160304062738/http://www.lemonde.fr/disparitions/rss_full.xml', 'value': 'Mort de Claude Parent, théoricien de l’architecture'}","L’architecte, inventeur avec Paul Virilio de la théorie de « la fonction oblique », s’est éteint à l’âge de 93 ans.","{'type': 'text/html', 'language': None, 'base': 'http://web.archive.org/web/20160304062738/http://www.lemonde.fr/disparitions/rss_full.xml', 'value': 'L’architecte, inventeur avec Paul Virilio de la théorie de «\xa0la fonction oblique\xa0», s’est éteint à l’âge de 93 ans.'}","Sun, 28 Feb 2016 17:54:24 +0100","time.struct_time(tm_year=2016, tm_mon=2, tm_mday=28, tm_hour=16, tm_min=54, tm_sec=24, tm_wday=6, tm_yday=59, tm_isdst=0)",http://www.lemonde.fr/tiny/4873247/,False
"[{'rel': 'alternate', 'type': 'text/html', 'href': 'http://www.lemonde.fr/disparitions/article/2016/02/25/deces-de-francois-dupeyron-realisateur-de-la-chambre-des-officiers_4871655_3382.html'}, {'type': 'image/jpeg', 'length': '33028', 'href': 'http://s2.lemde.fr/image/2016/02/25/644x322/4871722_3_fd1c_francois-dupeyron-a-cannes-en-mai-2009_6abd5bf8fef833c8a352dd5b4ad0ae3d.jpg', 'rel': 'enclosure'}]",http://www.lemonde.fr/disparitions/article/2016/02/25/deces-de-francois-dupeyron-realisateur-de-la-chambre-des-officiers_4871655_3382.html,"Mort de François Dupeyron, réalisateur de « La Chambre des officiers »","{'type': 'text/plain', 'language': None, 'base': 'http://web.archive.org/web/20160304062738/http://www.lemonde.fr/disparitions/rss_full.xml', 'value': 'Mort de François Dupeyron, réalisateur de «\xa0La Chambre des officiers\xa0»'}",Le cinéaste s’est éteint à l’âge de 65 ans des suites d’une longue maladie.,"{'type': 'text/html', 'language': None, 'base': 'http://web.archive.org/web/20160304062738/http://www.lemonde.fr/disparitions/rss_full.xml', 'value': 'Le cinéaste s’est éteint à l’âge de 65 ans des suites d’une longue maladie.'}","Thu, 25 Feb 2016 12:19:38 +0100","time.struct_time(tm_year=2016, tm_mon=2, tm_mday=25, tm_hour=11, tm_min=19, tm_sec=38, tm_wday=3, tm_yday=56, tm_isdst=0)",http://www.lemonde.fr/tiny/4871655/,False
"[{'rel': 'alternate', 'type': 'text/html', 'href': 'http://www.lemonde.fr/disparitions/article/2016/02/21/mort-du-dernier-survivant-de-la-revolte-dans-le-camp-nazi-de-treblinka_4869172_3382.html'}, {'type': 'image/jpeg', 'length': '39297', 'href': 'http://s1.lemde.fr/image/2016/02/21/644x322/4869207_3_56e8_samuel-willenberg-deplie-une-carte-du-camp_6098775e79f4fa8965d4f8d0df383f3d.jpg', 'rel': 'enclosure'}]",http://www.lemonde.fr/disparitions/article/2016/02/21/mort-du-dernier-survivant-de-la-revolte-dans-le-camp-nazi-de-treblinka_4869172_3382.html,Mort du dernier survivant de la révolte dans le camp nazi de Treblinka,"{'type': 'text/plain', 'language': None, 'base': 'http://web.archive.org/web/20160304062738/http://www.lemonde.fr/disparitions/rss_full.xml', 'value': 'Mort du dernier survivant de la révolte dans le camp nazi de Treblinka'}","Déporté à l’âge de 19 ans, Samuel Willenberg a été un des instigateurs d’une des rares révoltes qui se soient produites dans les camps d’extermination.","{'type': 'text/html', 'language': None, 'base': 'http://web.archive.org/web/20160304062738/http://www.lemonde.fr/disparitions/rss_full.xml', 'value': 'Déporté à l’âge de 19 ans, Samuel Willenberg a été un des instigateurs d’une des rares révoltes qui se soient produites dans les camps d’extermination.'}","Sun, 21 Feb 2016 10:15:14 +0100","time.struct_time(tm_year=2016, tm_mon=2, tm_mday=21, tm_hour=9, tm_min=15, tm_sec=14, tm_wday=6, tm_yday=52, tm_isdst=0)",http://www.lemonde.fr/tiny/4869172/,False
"[{'rel': 'alternate', 'type': 'text/html', 'href': 'http://www.lemonde.fr/europe/article/2016/02/20/le-prochain-livre-d-umberto-eco-sortira-au-mois-de-mars-en-italie_4869025_3214.html'}, {'type': 'image/jpeg', 'length': '64865', 'href': 'http://s2.lemde.fr/image/2016/02/20/644x322/4869024_3_06ec_umberto-eco-ecrivain-italien-dans-la_00883d4a2eecc0221613eaaa0ec94aef.jpg', 'rel': 'enclosure'}]",http://www.lemonde.fr/europe/article/2016/02/20/le-prochain-livre-d-umberto-eco-sortira-au-mois-de-mars-en-italie_4869025_3214.html,"Des obsèques laïques pour Umberto Eco, avant « Satàn »","{'type': 'text/plain', 'language': None, 'base': 'http://web.archive.org/web/20160304062738/http://www.lemonde.fr/disparitions/rss_full.xml', 'value': 'Des obsèques laïques pour Umberto Eco, avant «\xa0Satàn\xa0»'}","Avant sa mort, l’écrivain italien avait eu le temps de relire les épreuves de son recueil de chroniques, « Pape Satàn Alleppe ».","{'type': 'text/html', 'language': None, 'base': 'http://web.archive.org/web/20160304062738/http://www.lemonde.fr/disparitions/rss_full.xml', 'value': 'Avant sa mort, l’écrivain italien avait eu le temps de relire les épreuves de son recueil de chroniques, «\xa0Pape Satàn Alleppe\xa0».'}","Sat, 20 Feb 2016 14:26:33 +0100","time.struct_time(tm_year=2016, tm_mon=2, tm_mday=20, tm_hour=13, tm_min=26, tm_sec=33, tm_wday=5, tm_yday=51, tm_isdst=0)",http://www.lemonde.fr/tiny/4869025/,False
"[{'rel': 'alternate', 'type': 'text/html', 'href': 'http://www.lemonde.fr/culture/article/2016/02/20/mort-d-umberto-eco-son-regard-sur-le-monde-nous-manquera_4868889_3246.html'}, {'type': 'image/jpeg', 'length': '20738', 'href': 'http://s1.lemde.fr/image/2016/02/20/644x322/4868888_3_4c68_umberto-eco-le-23-fevrier-2011_58d490865f01f68fd3148e023df54096.jpg', 'rel': 'enclosure'}]",http://www.lemonde.fr/culture/article/2016/02/20/mort-d-umberto-eco-son-regard-sur-le-monde-nous-manquera_4868889_3246.html,Mort d’Umberto Eco : « Son regard sur le monde nous manquera »,"{'type': 'text/plain', 'language': None, 'base': 'http://web.archive.org/web/20160304062738/http://www.lemonde.fr/disparitions/rss_full.xml', 'value': 'Mort d’Umberto Eco\xa0: «\xa0Son regard sur le monde nous manquera\xa0»'}","Le monde a salué « l’immense intellectuel européen » qu’était l’écrivain italien, mort vendredi soir.","{'type': 'text/html', 'language': None, 'base': 'http://web.archive.org/web/20160304062738/http://www.lemonde.fr/disparitions/rss_full.xml', 'value': 'Le monde a salué «\xa0l’immense intellectuel européen\xa0» qu’était l’écrivain italien, mort vendredi soir.'}","Sat, 20 Feb 2016 09:44:15 +0100","time.struct_time(tm_year=2016, tm_mon=2, tm_mday=20, tm_hour=8, tm_min=44, tm_sec=15, tm_wday=5, tm_yday=51, tm_isdst=0)",http://www.lemonde.fr/tiny/4868889/,False
"[{'rel': 'alternate', 'type': 'text/html', 'href': 'http://www.lemonde.fr/livres/article/2016/02/20/le-succes-inattendu-du-nom-de-la-rose-le-chef-d-uvre-d-umberto-eco_4868793_3260.html'}, {'type': 'image/jpeg', 'length': '30752', 'href': 'http://s2.lemde.fr/image/2015/02/25/644x322/4583064_3_6650_umberto-eco-a-milan-en-fevrier-2011_5ff9f70c4bdea5f7a5fd55cde6c9f4a2.jpg', 'rel': 'enclosure'}]",http://www.lemonde.fr/livres/article/2016/02/20/le-succes-inattendu-du-nom-de-la-rose-le-chef-d-uvre-d-umberto-eco_4868793_3260.html,"Le succès inattendu du « Nom de la rose », le chef-d’œuvre d’Umberto Eco","{'type': 'text/plain', 'language': None, 'base': 'http://web.archive.org/web/20160304062738/http://www.lemonde.fr/disparitions/rss_full.xml', 'value': 'Le succès inattendu du «\xa0Nom de la rose\xa0», le chef-d’œuvre d’Umberto Eco'}","Rien ne prédestinait l’ouvrage d’Umberto Eco, mort le 19 février à l’âge de 84 ans, au succès qu’il a rencontré.","{'type': 'text/html', 'language': None, 'base': 'http://web.archive.org/web/20160304062738/http://www.lemonde.fr/disparitions/rss_full.xml', 'value': 'Rien ne prédestinait l’ouvrage d’Umberto Eco, mort le 19\xa0février à l’âge de 84 ans, au succès qu’il a rencontré.'}","Sat, 20 Feb 2016 01:35:25 +0100","time.struct_time(tm_year=2016, tm_mon=2, tm_mday=20, tm_hour=0, tm_min=35, tm_sec=25, tm_wday=5, tm_yday=51, tm_isdst=0)",http://www.lemonde.fr/tiny/4868793/,False
"[{'rel': 'alternate', 'type': 'text/html', 'href': 'http://www.lemonde.fr/disparitions/article/2016/02/20/umberto-eco-auteur-du-nom-de-la-rose-est-mort_4868787_3382.html'}, {'type': 'image/jpeg', 'length': '40373', 'href': 'http://s1.lemde.fr/image/2016/02/20/644x322/4868806_3_b7f7_l-ecrivain-italien-umberto-eco-professeur-a-l_02e6a532e091948bfe032d54f3cd93e9.jpg', 'rel': 'enclosure'}]",http://www.lemonde.fr/disparitions/article/2016/02/20/umberto-eco-auteur-du-nom-de-la-rose-est-mort_4868787_3382.html,"Umberto Eco, auteur du « Nom de la rose » : mort du plus lettré des rêveurs","{'type': 'text/plain', 'language': None, 'base': 'http://web.archive.org/web/20160304062738/http://www.lemonde.fr/disparitions/rss_full.xml', 'value': 'Umberto Eco, auteur du «\xa0Nom de la rose\xa0»\xa0: mort du plus lettré des rêveurs'}","L’intellectuel italien est décédé d’un cancer, le 19 février, à 84 ans.","{'type': 'text/html', 'language': None, 'base': 'http://web.archive.org/web/20160304062738/http://www.lemonde.fr/disparitions/rss_full.xml', 'value': 'L’intellectuel italien est décédé d’un cancer, le 19 février, à 84 ans.'}","Sat, 20 Feb 2016 01:33:54 +0100","time.struct_time(tm_year=2016, tm_mon=2, tm_mday=20, tm_hour=0, tm_min=33, tm_sec=54, tm_wday=5, tm_yday=51, tm_isdst=0)",http://www.lemonde.fr/tiny/4868787/,False
"[{'rel': 'alternate', 'type': 'text/html', 'href': 'http://www.lemonde.fr/culture/article/2016/02/19/mort-de-harper-lee-auteure-de-ne-tirez-pas-sur-l-oiseau-moqueur_4868597_3246.html'}, {'type': 'image/jpeg', 'length': '17212', 'href': 'http://s2.lemde.fr/image/2016/02/19/644x322/4868657_3_4bd2_harper-lee-en-1963_192d52a18dab9af20936b0e098c78e09.jpg', 'rel': 'enclosure'}]",http://www.lemonde.fr/culture/article/2016/02/19/mort-de-harper-lee-auteure-de-ne-tirez-pas-sur-l-oiseau-moqueur_4868597_3246.html,"Harper Lee, auteure de « Ne tirez pas sur l’oiseau moqueur », est morte","{'type': 'text/plain', 'language': None, 'base': 'http://web.archive.org/web/20160304062738/http://www.lemonde.fr/disparitions/rss_full.xml', 'value': 'Harper Lee, auteure de «\xa0Ne tirez pas sur l’oiseau moqueur\xa0», est morte'}","La romancière américaine, prix Pulitzer en 1961, s’est éteinte, le 19 février, à 89 ans.","{'type': 'text/html', 'language': None, 'base': 'http://web.archive.org/web/20160304062738/http://www.lemonde.fr/disparitions/rss_full.xml', 'value': 'La romancière américaine, prix Pulitzer en 1961, s’est éteinte, le 19 février, à 89 ans.'}","Fri, 19 Feb 2016 17:00:11 +0100","time.struct_time(tm_year=2016, tm_mon=2, tm_mday=19, tm_hour=16, tm_min=0, tm_sec=11, tm_wday=4, tm_yday=50, tm_isdst=0)",http://www.lemonde.fr/tiny/4868597/,False
"[{'rel': 'alternate', 'type': 'text/html', 'href': 'http://www.lemonde.fr/disparitions/article/2016/02/17/mort-du-realisateur-polonais-andrzej-zulawski_4866898_3382.html'}, {'type': 'image/jpeg', 'length': '34747', 'href': 'http://s1.lemde.fr/image/2016/02/17/644x322/4866897_3_1839_andrzej-u-awski-en-juillet-2006-a-moscou_0b71ba925fa8ea3d019a61beda4880b4.jpg', 'rel': 'enclosure'}]",http://www.lemonde.fr/disparitions/article/2016/02/17/mort-du-realisateur-polonais-andrzej-zulawski_4866898_3382.html,"Mort d’Andrzej Zulawski, cinéaste de la passion","{'type': 'text/plain', 'language': None, 'base': 'http://web.archive.org/web/20160304062738/http://www.lemonde.fr/disparitions/rss_full.xml', 'value': 'Mort d’Andrzej Zulawski, cinéaste de la passion'}",Le réalisateur de « L’important c’est d’aimer » (1975) et « Possession » (1981) s’est éteint dans la nuit de mardi à 75 ans.,"{'type': 'text/html', 'language': None, 'base': 'http://web.archive.org/web/20160304062738/http://www.lemonde.fr/disparitions/rss_full.xml', 'value': 'Le réalisateur de «\xa0L’important c’est d’aimer\xa0» (1975) et «\xa0Possession\xa0» (1981) s’est éteint dans la nuit de mardi à 75 ans.'}","Wed, 17 Feb 2016 12:12:40 +0100","time.struct_time(tm_year=2016, tm_mon=2, tm_mday=17, tm_hour=11, tm_min=12, tm_sec=40, tm_wday=2, tm_yday=48, tm_isdst=0)",http://www.lemonde.fr/tiny/4866898/,False
"[{'rel': 'alternate', 'type': 'text/html', 'href': 'http://www.lemonde.fr/disparitions/article/2016/02/16/mort-de-la-militante-feministe-therese-clerc_4866423_3382.html'}, {'type': 'image/jpeg', 'length': '23080', 'href': 'http://s2.lemde.fr/image/2016/02/16/644x322/4866421_3_7b94_la-militante-feministe-therese-clerc-ici-en-fe_0897a426f5310e3d873ac2e032511988.jpg', 'rel': 'enclosure'}]",http://www.lemonde.fr/disparitions/article/2016/02/16/mort-de-la-militante-feministe-therese-clerc_4866423_3382.html,Mort de la militante féministe Thérèse Clerc,"{'type': 'text/plain', 'language': None, 'base': 'http://web.archive.org/web/20160304062738/http://www.lemonde.fr/disparitions/rss_full.xml', 'value': 'Mort de la militante féministe Thérèse Clerc'}","Thérèse Clerc avait fondé la Maison des femmes, ouverte aux femmes victimes de violence et la Maison des Babayagas, résidence autogérée pour femmes âgées.","{'type': 'text/html', 'language': None, 'base': 'http://web.archive.org/web/20160304062738/http://www.lemonde.fr/disparitions/rss_full.xml', 'value': 'Thérèse Clerc avait fondé la Maison des femmes, ouverte aux femmes victimes de violence et la Maison des Babayagas, résidence autogérée pour femmes âgées.'}","Tue, 16 Feb 2016 17:05:56 +0100","time.struct_time(tm_year=2016, tm_mon=2, tm_mday=16, tm_hour=16, tm_min=5, tm_sec=56, tm_wday=1, tm_yday=47, tm_isdst=0)",http://www.lemonde.fr/tiny/4866423/,False
"[{'rel': 'alternate', 'type': 'text/html', 'href': 'http://www.lemonde.fr/disparitions/article/2016/02/16/mort-de-boutros-boutros-ghali-ancien-secretaire-general-des-nation-unies_4866380_3382.html'}, {'type': 'image/jpeg', 'length': '29688', 'href': 'http://s1.lemde.fr/image/2016/02/16/644x322/4866387_3_9796_l-ancien-secretaire-general-des-nations-un_d355f6225fe56a73250b72935f4cb628.jpg', 'rel': 'enclosure'}]",http://www.lemonde.fr/disparitions/article/2016/02/16/mort-de-boutros-boutros-ghali-ancien-secretaire-general-des-nation-unies_4866380_3382.html,"Mort de Boutros Boutros-Ghali, ancien secrétaire général des Nations unies","{'type': 'text/plain', 'language': None, 'base': 'http://web.archive.org/web/20160304062738/http://www.lemonde.fr/disparitions/rss_full.xml', 'value': 'Mort de Boutros Boutros-Ghali, ancien secrétaire général des Nations unies'}",Le diplomate égyptien s’est éteint à l’âge de 93 ans. Il avait été le premier Africain à accéder au poste de secrétaire général de l’ONU.,"{'type': 'text/html', 'language': None, 'base': 'http://web.archive.org/web/20160304062738/http://www.lemonde.fr/disparitions/rss_full.xml', 'value': 'Le diplomate égyptien s’est éteint à l’âge de 93 ans. Il avait été le premier Africain à accéder au poste de secrétaire général de l’ONU.'}","Tue, 16 Feb 2016 16:26:07 +0100","time.struct_time(tm_year=2016, tm_mon=2, tm_mday=16, tm_hour=15, tm_min=26, tm_sec=7, tm_wday=1, tm_yday=47, tm_isdst=0)",http://www.lemonde.fr/tiny/4866380/,False
"[{'rel': 'alternate', 'type': 'text/html', 'href': 'http://www.lemonde.fr/ameriques/article/2016/02/13/antonin-scalia-doyen-de-la-cour-supreme-des-etats-unis-est-mort_4865023_3222.html'}, {'type': 'image/jpeg', 'length': '19547', 'href': 'http://s2.lemde.fr/image/2016/02/13/644x322/4865022_3_cec5_antonin-scalia-etait-adule-par-les-c_1a6aae55a87a66a60b53d35732504e1b.jpg', 'rel': 'enclosure'}]",http://www.lemonde.fr/ameriques/article/2016/02/13/antonin-scalia-doyen-de-la-cour-supreme-des-etats-unis-est-mort_4865023_3222.html,"Antonin Scalia, doyen ultraconservateur de la Cour suprême des Etats-Unis, est mort","{'type': 'text/plain', 'language': None, 'base': 'http://web.archive.org/web/20160304062738/http://www.lemonde.fr/disparitions/rss_full.xml', 'value': 'Antonin Scalia, doyen ultraconservateur de la Cour suprême des Etats-Unis, est mort'}","En pleine campagne électorale, la question de son remplacement, qui déterminera la coloration politique de la plus haute instance judiciaire du pays, est explosive.","{'type': 'text/html', 'language': None, 'base': 'http://web.archive.org/web/20160304062738/http://www.lemonde.fr/disparitions/rss_full.xml', 'value': 'En pleine campagne électorale, la question de son remplacement, qui déterminera la coloration politique de la plus haute instance judiciaire du pays, est explosive.'}","Sat, 13 Feb 2016 23:45:47 +0100","time.struct_time(tm_year=2016, tm_mon=2, tm_mday=13, tm_hour=22, tm_min=45, tm_sec=47, tm_wday=5, tm_yday=44, tm_isdst=0)",http://www.lemonde.fr/tiny/4865023/,False
"[{'rel': 'alternate', 'type': 'text/html', 'href': 'http://www.lemonde.fr/disparitions/article/2016/02/09/la-romanciere-historique-juliette-benzoni-est-morte_4862127_3382.html'}, {'type': 'image/jpeg', 'length': '35084', 'href': 'http://s1.lemde.fr/image/2016/02/09/644x322/4862126_3_2031_l-ecrivaine-juliette-benzoni-lors-de_ddf40f8643358d11268085202b7c5abc.jpg', 'rel': 'enclosure'}]",http://www.lemonde.fr/disparitions/article/2016/02/09/la-romanciere-historique-juliette-benzoni-est-morte_4862127_3382.html,"La reine du roman historique, Juliette Benzoni, est morte","{'type': 'text/plain', 'language': None, 'base': 'http://web.archive.org/web/20160304062738/http://www.lemonde.fr/disparitions/rss_full.xml', 'value': 'La reine du roman historique, Juliette Benzoni, est morte'}","Traduits dans une vingtaine de langues, ses romans se sont vendus à quelque 300 millions d’exemplaires.","{'type': 'text/html', 'language': None, 'base': 'http://web.archive.org/web/20160304062738/http://www.lemonde.fr/disparitions/rss_full.xml', 'value': 'Traduits dans une vingtaine de langues, ses romans se sont vendus à quelque 300\xa0millions d’exemplaires.'}","Tue, 09 Feb 2016 15:12:06 +0100","time.struct_time(tm_year=2016, tm_mon=2, tm_mday=9, tm_hour=14, tm_min=12, tm_sec=6, tm_wday=1, tm_yday=40, tm_isdst=0)",http://www.lemonde.fr/tiny/4862127/,False
"[{'rel': 'alternate', 'type': 'text/html', 'href': 'http://www.lemonde.fr/disparitions/article/2016/02/07/mort-d-anissa-makhlouf-mere-de-bachar-al-assad-soutien-en-coulisses-de-la-repression-syrienne_4860909_3382.html'}, {'type': 'image/jpeg', 'length': '24755', 'href': 'http://s2.lemde.fr/image/2016/02/07/644x322/4860908_3_628a_anissa-makhlouf-al-assad-mere-du-president-s_1e8f7eff59774d09997ae2f0bc8170ca.jpg', 'rel': 'enclosure'}]",http://www.lemonde.fr/disparitions/article/2016/02/07/mort-d-anissa-makhlouf-mere-de-bachar-al-assad-soutien-en-coulisses-de-la-repression-syrienne_4860909_3382.html,"Mort d’Anissa Makhlouf, mère de Bachar Al-Assad","{'type': 'text/plain', 'language': None, 'base': 'http://web.archive.org/web/20160304062738/http://www.lemonde.fr/disparitions/rss_full.xml', 'value': 'Mort d’Anissa Makhlouf, mère de Bachar Al-Assad'}","L’épouse de l’ancien président Hafez Al-Assad, soutien de la répression syrienne, figurait depuis 2012 sur la liste noire de l’Union européenne","{'type': 'text/html', 'language': None, 'base': 'http://web.archive.org/web/20160304062738/http://www.lemonde.fr/disparitions/rss_full.xml', 'value': 'L’épouse de l’ancien président Hafez Al-Assad, soutien de la répression syrienne, figurait depuis 2012 sur la liste noire de l’Union européenne'}","Sun, 07 Feb 2016 10:44:35 +0100","time.struct_time(tm_year=2016, tm_mon=2, tm_mday=7, tm_hour=9, tm_min=44, tm_sec=35, tm_wday=6, tm_yday=38, tm_isdst=0)",http://www.lemonde.fr/tiny/4860909/,False
"[{'rel': 'alternate', 'type': 'text/html', 'href': 'http://www.lemonde.fr/sport/article/2016/02/05/mort-de-dave-mirra-legende-du-bmx_4860233_3242.html'}, {'type': 'image/jpeg', 'length': '50322', 'href': 'http://s1.lemde.fr/image/2016/02/05/644x322/4860230_3_cf91_dave-mirra-durant-les-x-games-le-22-aout_53934223fbadbb9c40770c8101454c14.jpg', 'rel': 'enclosure'}]",http://www.lemonde.fr/sport/article/2016/02/05/mort-de-dave-mirra-legende-du-bmx_4860233_3242.html,"Mort de Dave Mirra, légende du BMX","{'type': 'text/plain', 'language': None, 'base': 'http://web.archive.org/web/20160304062738/http://www.lemonde.fr/disparitions/rss_full.xml', 'value': 'Mort de Dave Mirra, légende du BMX'}","Dave Mirra, 24 fois médaillé aux X Games, était une véritable icône dans cette discipline. Il se serait suicidé, à l’âge de 41 ans.","{'type': 'text/html', 'language': None, 'base': 'http://web.archive.org/web/20160304062738/http://www.lemonde.fr/disparitions/rss_full.xml', 'value': 'Dave Mirra, 24 fois médaillé aux X Games, était une véritable icône dans cette discipline. Il se serait suicidé, à l’âge de 41 ans.'}","Fri, 05 Feb 2016 15:05:49 +0100","time.struct_time(tm_year=2016, tm_mon=2, tm_mday=5, tm_hour=14, tm_min=5, tm_sec=49, tm_wday=4, tm_yday=36, tm_isdst=0)",http://www.lemonde.fr/tiny/4860233/,False
