links,link,title,title_detail,summary,summary_detail,published,published_parsed,id,guidislink
"[{'rel': 'alternate', 'type': 'text/html', 'href': 'http://www.lemonde.fr/disparitions/article/2016/09/10/mort-d-yves-meudal-un-des-derniers-survivants-du-commando-kieffer_4995679_3382.html'}, {'type': 'image/jpeg', 'length': '65861', 'href': 'http://s1.lemde.fr/image/2016/09/10/644x322/4995677_3_f016_photo-de-la-plage-de-colleville-montgomery-ou_bf1fafc7ae788fd755709c4b1793469e.jpg', 'rel': 'enclosure'}]",http://www.lemonde.fr/disparitions/article/2016/09/10/mort-d-yves-meudal-un-des-derniers-survivants-du-commando-kieffer_4995679_3382.html,"Mort d’Yves Meudal, un des derniers survivants du commando Kieffer","{'type': 'text/plain', 'language': None, 'base': 'http://web.archive.org/web/20160910180740/http://www.lemonde.fr/disparitions/rss_full.xml', 'value': 'Mort d’Yves Meudal, un des derniers survivants du commando Kieffer'}","Aux côtés des 177 fusiliers marins des Forces françaises libres du commando Kieffer, il avait participé au débarquement du 6 juin 1944 à Sword Beach.","{'type': 'text/html', 'language': None, 'base': 'http://web.archive.org/web/20160910180740/http://www.lemonde.fr/disparitions/rss_full.xml', 'value': 'Aux côtés des 177 fusiliers marins des Forces françaises libres du commando Kieffer, il avait participé au débarquement du 6\xa0juin 1944 à Sword Beach.'}","Sat, 10 Sep 2016 16:30:30 +0200","time.struct_time(tm_year=2016, tm_mon=9, tm_mday=10, tm_hour=14, tm_min=30, tm_sec=30, tm_wday=5, tm_yday=254, tm_isdst=0)",http://www.lemonde.fr/tiny/4995679/,False
"[{'rel': 'alternate', 'type': 'text/html', 'href': 'http://www.lemonde.fr/disparitions/article/2016/09/10/mort-de-jacques-dominati-ancien-senateur_4995580_3382.html'}, {'type': 'image/jpeg', 'length': '25838', 'href': 'http://s2.lemde.fr/image/2016/09/10/644x322/4995578_3_4d09_jacques-dominati-en-1992_57a29379d0666e17fea464e1d265f83a.jpg', 'rel': 'enclosure'}]",http://www.lemonde.fr/disparitions/article/2016/09/10/mort-de-jacques-dominati-ancien-senateur_4995580_3382.html,"Mort de Jacques Dominati, ancien sénateur","{'type': 'text/plain', 'language': None, 'base': 'http://web.archive.org/web/20160910180740/http://www.lemonde.fr/disparitions/rss_full.xml', 'value': 'Mort de Jacques Dominati, ancien sénateur'}","Le centriste, maire du 3e arrondissement de Paris de 1983 à 1995, avait fait du pouvoir une affaire de famille.","{'type': 'text/html', 'language': None, 'base': 'http://web.archive.org/web/20160910180740/http://www.lemonde.fr/disparitions/rss_full.xml', 'value': 'Le centriste, maire du 3e arrondissement de Paris de 1983 à 1995, avait fait du pouvoir une affaire de famille.'}","Sat, 10 Sep 2016 10:23:56 +0200","time.struct_time(tm_year=2016, tm_mon=9, tm_mday=10, tm_hour=8, tm_min=23, tm_sec=56, tm_wday=5, tm_yday=254, tm_isdst=0)",http://www.lemonde.fr/tiny/4995580/,False
"[{'rel': 'alternate', 'type': 'text/html', 'href': 'http://www.lemonde.fr/musiques/article/2016/09/09/le-tenor-sud-africain-johan-botha-est-mort_4995328_1654986.html'}, {'type': 'image/jpeg', 'length': '35536', 'href': 'http://s1.lemde.fr/image/2016/09/09/644x322/4995326_3_c900_le-tenor-sud-africain-johan-botha-dans-le_aec5b4ce84c6e1bb6962d813302b04be.jpg', 'rel': 'enclosure'}]",http://www.lemonde.fr/musiques/article/2016/09/09/le-tenor-sud-africain-johan-botha-est-mort_4995328_1654986.html,Le ténor sud-africain Johan Botha est mort,"{'type': 'text/plain', 'language': None, 'base': 'http://web.archive.org/web/20160910180740/http://www.lemonde.fr/disparitions/rss_full.xml', 'value': 'Le ténor sud-africain Johan Botha est mort'}","Pilier de l’Opéra de Vienne depuis 1996, spécialiste de Wagner et Verdi, le chanteur s’est éteint à l’âge de 51 ans.","{'type': 'text/html', 'language': None, 'base': 'http://web.archive.org/web/20160910180740/http://www.lemonde.fr/disparitions/rss_full.xml', 'value': 'Pilier de l’Opéra de Vienne depuis 1996, spécialiste de Wagner et Verdi, le chanteur s’est éteint à l’âge de 51 ans.'}","Fri, 09 Sep 2016 17:02:06 +0200","time.struct_time(tm_year=2016, tm_mon=9, tm_mday=9, tm_hour=15, tm_min=2, tm_sec=6, tm_wday=4, tm_yday=253, tm_isdst=0)",http://www.lemonde.fr/tiny/4995328/,False
"[{'rel': 'alternate', 'type': 'text/html', 'href': 'http://www.lemonde.fr/musiques/article/2016/09/06/jerry-heller-manager-du-gangsta-rap-est-mort_4993524_1654986.html'}, {'type': 'image/jpeg', 'length': '30494', 'href': 'http://s2.lemde.fr/image/2016/09/06/644x322/4993523_3_6209_jerry-heller-le-manager-du-groupe-de-gangsta_10c8a08bb56037f8ab15e910289eedd7.jpg', 'rel': 'enclosure'}]",http://www.lemonde.fr/musiques/article/2016/09/06/jerry-heller-manager-du-gangsta-rap-est-mort_4993524_1654986.html,"Jerry Heller, manager du gangsta rap, est mort","{'type': 'text/plain', 'language': None, 'base': 'http://web.archive.org/web/20160910180740/http://www.lemonde.fr/disparitions/rss_full.xml', 'value': 'Jerry Heller, manager du gangsta rap, est mort'}","Personnage éminent mais controversé de l’industrie du disque, le producteur avait notamment lancé la carrière de NWA.","{'type': 'text/html', 'language': None, 'base': 'http://web.archive.org/web/20160910180740/http://www.lemonde.fr/disparitions/rss_full.xml', 'value': 'Personnage éminent mais controversé de l’industrie du disque, le producteur avait notamment lancé la carrière de NWA.'}","Tue, 06 Sep 2016 17:18:17 +0200","time.struct_time(tm_year=2016, tm_mon=9, tm_mday=6, tm_hour=15, tm_min=18, tm_sec=17, tm_wday=1, tm_yday=250, tm_isdst=0)",http://www.lemonde.fr/tiny/4993524/,False
"[{'rel': 'alternate', 'type': 'text/html', 'href': 'http://www.lemonde.fr/asie-pacifique/article/2016/09/03/islam-karimov-un-apparatchik-sovietique-devenu-president-a-vie_4991985_3216.html'}, {'type': 'image/jpeg', 'length': '28258', 'href': 'http://s1.lemde.fr/image/2016/09/03/644x322/4991984_3_a6e8_le-president-ouzbek-islam-karimov-a-t_b731b05bc7635acb4811759f6489b73b.jpg', 'rel': 'enclosure'}]",http://www.lemonde.fr/asie-pacifique/article/2016/09/03/islam-karimov-un-apparatchik-sovietique-devenu-president-a-vie_4991985_3216.html,"Islam Karimov, un apparatchik soviétique devenu président à vie","{'type': 'text/plain', 'language': None, 'base': 'http://web.archive.org/web/20160910180740/http://www.lemonde.fr/disparitions/rss_full.xml', 'value': 'Islam Karimov, un apparatchik soviétique devenu président à vie'}","Habitué à régner d’une main de fer, le dirigeant ouzbek avait su exploiter la position stratégique de son pays et résister aux pressions de Moscou.","{'type': 'text/html', 'language': None, 'base': 'http://web.archive.org/web/20160910180740/http://www.lemonde.fr/disparitions/rss_full.xml', 'value': 'Habitué à régner d’une main de fer, le dirigeant ouzbek avait su exploiter la position stratégique de son pays et résister aux pressions de Moscou.'}","Sat, 03 Sep 2016 09:27:32 +0200","time.struct_time(tm_year=2016, tm_mon=9, tm_mday=3, tm_hour=7, tm_min=27, tm_sec=32, tm_wday=5, tm_yday=247, tm_isdst=0)",http://www.lemonde.fr/tiny/4991985/,False
"[{'rel': 'alternate', 'type': 'text/html', 'href': 'http://www.lemonde.fr/disparitions/article/2016/09/02/le-president-de-l-ouzbekistan-islam-karimov-est-mort_4991841_3382.html'}, {'type': 'image/jpeg', 'length': '32188', 'href': 'http://s2.lemde.fr/image/2016/09/02/644x322/4991838_3_29ea_islam-karimov-a-moscou-en-avril-2013_e44547313adf98b594a472aff9b62edb.jpg', 'rel': 'enclosure'}]",http://www.lemonde.fr/disparitions/article/2016/09/02/le-president-de-l-ouzbekistan-islam-karimov-est-mort_4991841_3382.html,"Le président de l’Ouzbékistan, Islam Karimov, est mort","{'type': 'text/plain', 'language': None, 'base': 'http://web.archive.org/web/20160910180740/http://www.lemonde.fr/disparitions/rss_full.xml', 'value': 'Le président de l’Ouzbékistan,\xa0Islam Karimov, est mort'}","L’ancien apparatchik soviétique a dirigé sans discontinuer l’Ouzbékistan depuis l’indépendance de cette république, acquise en août 1991.","{'type': 'text/html', 'language': None, 'base': 'http://web.archive.org/web/20160910180740/http://www.lemonde.fr/disparitions/rss_full.xml', 'value': 'L’ancien apparatchik soviétique a dirigé sans discontinuer l’Ouzbékistan depuis l’indépendance de cette république, acquise en août\xa01991.'}","Fri, 02 Sep 2016 19:09:16 +0200","time.struct_time(tm_year=2016, tm_mon=9, tm_mday=2, tm_hour=17, tm_min=9, tm_sec=16, tm_wday=4, tm_yday=246, tm_isdst=0)",http://www.lemonde.fr/tiny/4991841/,False
"[{'rel': 'alternate', 'type': 'text/html', 'href': 'http://www.lemonde.fr/photo/article/2016/08/31/le-photographe-marc-riboud-est-mort_4990288_4789037.html'}, {'type': 'image/jpeg', 'length': '33981', 'href': 'http://s1.lemde.fr/image/2016/08/31/644x322/4990310_3_f678_le-photographe-francais-marc-riboud-au-musee-d_6403915ee7e326c90211d360cf26171d.jpg', 'rel': 'enclosure'}]",http://www.lemonde.fr/photo/article/2016/08/31/le-photographe-marc-riboud-est-mort_4990288_4789037.html,Le photographe Marc Riboud est mort,"{'type': 'text/plain', 'language': None, 'base': 'http://web.archive.org/web/20160910180740/http://www.lemonde.fr/disparitions/rss_full.xml', 'value': 'Le photographe Marc Riboud est mort'}","Le photographe français est décédé, mardi à l’âge de 93 ans, des suites d’une longue maladie, a annoncé sa famille.","{'type': 'text/html', 'language': None, 'base': 'http://web.archive.org/web/20160910180740/http://www.lemonde.fr/disparitions/rss_full.xml', 'value': 'Le photographe français est décédé, mardi à l’âge de 93\xa0ans, des suites d’une longue maladie, a annoncé sa famille.'}","Wed, 31 Aug 2016 10:20:39 +0200","time.struct_time(tm_year=2016, tm_mon=8, tm_mday=31, tm_hour=8, tm_min=20, tm_sec=39, tm_wday=2, tm_yday=244, tm_isdst=0)",http://www.lemonde.fr/tiny/4990288/,False
"[{'rel': 'alternate', 'type': 'text/html', 'href': 'http://www.lemonde.fr/disparitions/article/2016/08/29/gene-wilder-un-geant-de-la-comedie-americaine-est-mort_4989565_3382.html'}, {'type': 'image/jpeg', 'length': '53154', 'href': 'http://s2.lemde.fr/image/2016/08/30/644x322/4989611_3_6ba6_gene-wilder-lors-de-la-repetition-d-une-pie_f8062d11116acdbed39ccfe545991ebc.jpg', 'rel': 'enclosure'}]",http://www.lemonde.fr/disparitions/article/2016/08/29/gene-wilder-un-geant-de-la-comedie-americaine-est-mort_4989565_3382.html,"Gene Wilder, un géant de la comédie américaine, est mort","{'type': 'text/plain', 'language': None, 'base': 'http://web.archive.org/web/20160910180740/http://www.lemonde.fr/disparitions/rss_full.xml', 'value': 'Gene Wilder, un géant de la comédie américaine, est mort'}","L’acteur, interprète de Willy Wonka et pilier des films de Mel Brooks, est décédé lundi à l’âge de 83 ans.","{'type': 'text/html', 'language': None, 'base': 'http://web.archive.org/web/20160910180740/http://www.lemonde.fr/disparitions/rss_full.xml', 'value': 'L’acteur, interprète de Willy Wonka et pilier des films de Mel Brooks, est décédé lundi à l’âge de 83 ans.'}","Mon, 29 Aug 2016 22:57:54 +0200","time.struct_time(tm_year=2016, tm_mon=8, tm_mday=29, tm_hour=20, tm_min=57, tm_sec=54, tm_wday=0, tm_yday=242, tm_isdst=0)",http://www.lemonde.fr/tiny/4989565/,False
"[{'rel': 'alternate', 'type': 'text/html', 'href': 'http://www.lemonde.fr/disparitions/article/2016/08/29/la-mort-de-l-historien-louis-chatellier_4989405_3382.html'}, {'type': 'image/jpeg', 'length': '24711', 'href': 'http://s1.lemde.fr/image/2016/08/29/644x322/4989404_3_5088_2016-08-29-b15810a-7248-1flgi81_0b429ac910f78327edbcebe6a8b06ff6.jpg', 'rel': 'enclosure'}]",http://www.lemonde.fr/disparitions/article/2016/08/29/la-mort-de-l-historien-louis-chatellier_4989405_3382.html,La mort de l’historien Louis Châtellier,"{'type': 'text/plain', 'language': None, 'base': 'http://web.archive.org/web/20160910180740/http://www.lemonde.fr/disparitions/rss_full.xml', 'value': 'La mort de l’historien Louis Châtellier'}",Le spécialiste du catholicisme à l’époque moderne est mort à Luxembourg le 28 juillet à l’âge de 81 ans.,"{'type': 'text/html', 'language': None, 'base': 'http://web.archive.org/web/20160910180740/http://www.lemonde.fr/disparitions/rss_full.xml', 'value': 'Le spécialiste du catholicisme à l’époque moderne est mort à Luxembourg le 28 juillet à l’âge de 81 ans.'}","Mon, 29 Aug 2016 15:53:23 +0200","time.struct_time(tm_year=2016, tm_mon=8, tm_mday=29, tm_hour=13, tm_min=53, tm_sec=23, tm_wday=0, tm_yday=242, tm_isdst=0)",http://www.lemonde.fr/tiny/4989405/,False
"[{'rel': 'alternate', 'type': 'text/html', 'href': 'http://www.lemonde.fr/m-styles/article/2016/08/25/la-couturiere-sonia-rykiel-est-morte_4987763_4497319.html'}, {'type': 'image/jpeg', 'length': '27926', 'href': 'http://s2.lemde.fr/image/2016/08/25/644x322/4988031_3_5f01_sonia-rykiel-presente-deux-modeles-lors-d_b8efb2038c467b6e98f260381bf36e99.jpg', 'rel': 'enclosure'}]",http://www.lemonde.fr/m-styles/article/2016/08/25/la-couturiere-sonia-rykiel-est-morte_4987763_4497319.html,"La styliste Sonia Rykiel, créatrice d’une mode libre et insolente, est morte","{'type': 'text/plain', 'language': None, 'base': 'http://web.archive.org/web/20160910180740/http://www.lemonde.fr/disparitions/rss_full.xml', 'value': 'La styliste Sonia Rykiel, créatrice d’une mode libre et insolente, est morte'}","Icône de Saint-Germain, la créatrice de mode qui s’est fait connaître avec ses tricots est morte jeudi à l’âge de 86 ans. Elle avait ouvert sa maison en 1968.","{'type': 'text/html', 'language': None, 'base': 'http://web.archive.org/web/20160910180740/http://www.lemonde.fr/disparitions/rss_full.xml', 'value': 'Icône de Saint-Germain, la créatrice de mode qui s’est fait connaître avec ses tricots est morte jeudi à l’âge de 86 ans. Elle avait ouvert sa maison en 1968.'}","Thu, 25 Aug 2016 11:17:19 +0200","time.struct_time(tm_year=2016, tm_mon=8, tm_mday=25, tm_hour=9, tm_min=17, tm_sec=19, tm_wday=3, tm_yday=238, tm_isdst=0)",http://www.lemonde.fr/tiny/4987763/,False
"[{'rel': 'alternate', 'type': 'text/html', 'href': 'http://www.lemonde.fr/disparitions/article/2016/08/24/le-romancier-michel-butor-est-mort_4987526_3382.html'}, {'type': 'image/jpeg', 'length': '33655', 'href': 'http://s1.lemde.fr/image/2016/08/24/644x322/4987523_3_99da_michel-butor-le-9-mars-2011-a-paris_d8db43792fe9250263f880ea94ca1add.jpg', 'rel': 'enclosure'}]",http://www.lemonde.fr/disparitions/article/2016/08/24/le-romancier-michel-butor-est-mort_4987526_3382.html,"Michel Butor, figure du Nouveau Roman, est mort à 89 ans","{'type': 'text/plain', 'language': None, 'base': 'http://web.archive.org/web/20160910180740/http://www.lemonde.fr/disparitions/rss_full.xml', 'value': 'Michel Butor, figure du Nouveau Roman, est mort à 89 ans'}","Insatiable curieux, il est connu pour « La Modification », Prix Renaudot 1957, dont le mode de narration a marqué la littérature.","{'type': 'text/html', 'language': None, 'base': 'http://web.archive.org/web/20160910180740/http://www.lemonde.fr/disparitions/rss_full.xml', 'value': 'Insatiable curieux, il est connu pour «\xa0La Modification\xa0», Prix Renaudot 1957, dont le mode de narration a marqué la littérature.'}","Wed, 24 Aug 2016 21:06:49 +0200","time.struct_time(tm_year=2016, tm_mon=8, tm_mday=24, tm_hour=19, tm_min=6, tm_sec=49, tm_wday=2, tm_yday=237, tm_isdst=0)",http://www.lemonde.fr/tiny/4987526/,False
"[{'rel': 'alternate', 'type': 'text/html', 'href': 'http://www.lemonde.fr/disparitions/article/2016/08/24/horacio-salgan-le-maestro-centenaire-du-tango-est-mort_4987505_3382.html'}, {'type': 'image/jpeg', 'length': '50026', 'href': 'http://s2.lemde.fr/image/2016/08/24/644x322/4987502_3_f402_le-pianiste-argentin-horacio-salgan_f52f3ea770b1241d423a54192ce01523.jpg', 'rel': 'enclosure'}]",http://www.lemonde.fr/disparitions/article/2016/08/24/horacio-salgan-le-maestro-centenaire-du-tango-est-mort_4987505_3382.html,"Horacio Salgan, le maestro centenaire du tango, est mort","{'type': 'text/plain', 'language': None, 'base': 'http://web.archive.org/web/20160910180740/http://www.lemonde.fr/disparitions/rss_full.xml', 'value': 'Horacio Salgan, le maestro centenaire du tango, est mort'}","Le pianiste argentin est décédé à Buenos Aires, vendredi 19 août, deux mois après avoir fêté ses 100 ans.","{'type': 'text/html', 'language': None, 'base': 'http://web.archive.org/web/20160910180740/http://www.lemonde.fr/disparitions/rss_full.xml', 'value': 'Le pianiste argentin est décédé à Buenos Aires, vendredi 19\xa0août, deux mois après avoir fêté ses 100 ans.'}","Wed, 24 Aug 2016 19:18:10 +0200","time.struct_time(tm_year=2016, tm_mon=8, tm_mday=24, tm_hour=17, tm_min=18, tm_sec=10, tm_wday=2, tm_yday=237, tm_isdst=0)",http://www.lemonde.fr/tiny/4987505/,False
"[{'rel': 'alternate', 'type': 'text/html', 'href': 'http://www.lemonde.fr/international/article/2016/08/22/l-ancien-president-de-singapour-s-r-nathan-est-mort_4986454_3210.html'}, {'type': 'image/jpeg', 'length': '44297', 'href': 'http://s1.lemde.fr/image/2016/08/22/644x322/4986452_3_0051_le-president-singapourien-s-r-nathan-a-g_145d16505a24f7b54ba828668d338c75.jpg', 'rel': 'enclosure'}]",http://www.lemonde.fr/international/article/2016/08/22/l-ancien-president-de-singapour-s-r-nathan-est-mort_4986454_3210.html,L’ancien président de Singapour S.R. Nathan est mort,"{'type': 'text/plain', 'language': None, 'base': 'http://web.archive.org/web/20160910180740/http://www.lemonde.fr/disparitions/rss_full.xml', 'value': 'L’ancien président de Singapour S.R. Nathan est mort'}","L’ex-président, proche de l’un des pères fondateurs de Singapour Lee Kuan Yew, avait 92 ans.","{'type': 'text/html', 'language': None, 'base': 'http://web.archive.org/web/20160910180740/http://www.lemonde.fr/disparitions/rss_full.xml', 'value': 'L’ex-président, proche de l’un des pères fondateurs de Singapour Lee Kuan Yew, avait 92\xa0ans.'}","Mon, 22 Aug 2016 18:36:22 +0200","time.struct_time(tm_year=2016, tm_mon=8, tm_mday=22, tm_hour=16, tm_min=36, tm_sec=22, tm_wday=0, tm_yday=235, tm_isdst=0)",http://www.lemonde.fr/tiny/4986454/,False
"[{'rel': 'alternate', 'type': 'text/html', 'href': 'http://www.lemonde.fr/disparitions/article/2016/08/22/mort-du-musicien-toots-thielemans-legende-belge-du-jazz_4986170_3382.html'}, {'type': 'image/jpeg', 'length': '23101', 'href': 'http://s2.lemde.fr/image/2016/08/22/644x322/4986165_3_0deb_toots-thielemans-lors-de-la-30e-edi_0c9ae4e912312e48197ca6864db5ba84.jpg', 'rel': 'enclosure'}]",http://www.lemonde.fr/disparitions/article/2016/08/22/mort-du-musicien-toots-thielemans-legende-belge-du-jazz_4986170_3382.html,L’harmonica de « Toots » Thielemans s’est tu,"{'type': 'text/plain', 'language': None, 'base': 'http://web.archive.org/web/20160910180740/http://www.lemonde.fr/disparitions/rss_full.xml', 'value': 'L’harmonica de «\xa0Toots\xa0» Thielemans s’est tu'}","Le musicien belge, qui avait joué avec les plus grands (de Charlie Parker à Bill Evans), est mort, lundi 22 août, à l’âge de 94 ans.","{'type': 'text/html', 'language': None, 'base': 'http://web.archive.org/web/20160910180740/http://www.lemonde.fr/disparitions/rss_full.xml', 'value': 'Le musicien belge, qui avait joué avec les plus grands (de Charlie Parker à Bill Evans), est mort, lundi 22\xa0août, à l’âge de 94 ans.'}","Mon, 22 Aug 2016 12:31:42 +0200","time.struct_time(tm_year=2016, tm_mon=8, tm_mday=22, tm_hour=10, tm_min=31, tm_sec=42, tm_wday=0, tm_yday=235, tm_isdst=0)",http://www.lemonde.fr/tiny/4986170/,False
"[{'rel': 'alternate', 'type': 'text/html', 'href': 'http://www.lemonde.fr/culture/article/2016/08/21/lou-pearlman-producteur-des-backstreet-boys-est-mort_4985863_3246.html'}, {'type': 'image/jpeg', 'length': '40405', 'href': 'http://s1.lemde.fr/image/2016/08/21/644x322/4985860_3_1d59_lou-pearlman-en-2007_defd6ed6bf182757d7d4991e65f0bbf3.jpg', 'rel': 'enclosure'}]",http://www.lemonde.fr/culture/article/2016/08/21/lou-pearlman-producteur-des-backstreet-boys-est-mort_4985863_3246.html,"Lou Pearlman, producteur des Backstreet Boys, est mort","{'type': 'text/plain', 'language': None, 'base': 'http://web.archive.org/web/20160910180740/http://www.lemonde.fr/disparitions/rss_full.xml', 'value': 'Lou Pearlman, producteur des Backstreet Boys, est mort'}",L’ancien producteur de boys band américain s’est éteint en prison à l’âge de 62 ans.,"{'type': 'text/html', 'language': None, 'base': 'http://web.archive.org/web/20160910180740/http://www.lemonde.fr/disparitions/rss_full.xml', 'value': 'L’ancien producteur de boys band américain s’est éteint en prison à l’âge de 62 ans.'}","Sun, 21 Aug 2016 23:05:12 +0200","time.struct_time(tm_year=2016, tm_mon=8, tm_mday=21, tm_hour=21, tm_min=5, tm_sec=12, tm_wday=6, tm_yday=234, tm_isdst=0)",http://www.lemonde.fr/tiny/4985863/,False
"[{'rel': 'alternate', 'type': 'text/html', 'href': 'http://www.lemonde.fr/disparitions/article/2016/08/20/jerome-monod-industriel-et-conseiller-de-jacques-chirac-est-mort_4985539_3382.html'}, {'type': 'image/jpeg', 'length': '34244', 'href': 'http://s2.lemde.fr/image/2016/08/21/644x322/4985667_3_ed90_jerome-monod-a-droite-au-cote-de-jacq_0ad28944a24e258ba793e162089c3154.jpg', 'rel': 'enclosure'}]",http://www.lemonde.fr/disparitions/article/2016/08/20/jerome-monod-industriel-et-conseiller-de-jacques-chirac-est-mort_4985539_3382.html,"Jérôme Monod, industriel et conseiller de Jacques Chirac, est mort","{'type': 'text/plain', 'language': None, 'base': 'http://web.archive.org/web/20160910180740/http://www.lemonde.fr/disparitions/rss_full.xml', 'value': 'Jérôme Monod, industriel et conseiller de Jacques Chirac, est mort'}","L’ancien patron de la Lyonnaise des eaux, mort jeudi 18 août à 85 ans, fut le premier secrétaire général du RPR et l’une des éminences grises du président de la République.","{'type': 'text/html', 'language': None, 'base': 'http://web.archive.org/web/20160910180740/http://www.lemonde.fr/disparitions/rss_full.xml', 'value': 'L’ancien patron de la Lyonnaise des eaux, mort jeudi 18 août à 85 ans, fut le premier secrétaire général du RPR et l’une des éminences grises du président de la République.'}","Sat, 20 Aug 2016 16:50:17 +0200","time.struct_time(tm_year=2016, tm_mon=8, tm_mday=20, tm_hour=14, tm_min=50, tm_sec=17, tm_wday=5, tm_yday=233, tm_isdst=0)",http://www.lemonde.fr/tiny/4985539/,False
"[{'rel': 'alternate', 'type': 'text/html', 'href': 'http://www.lemonde.fr/disparitions/article/2016/08/18/mort-de-l-historien-allemand-ernst-nolte_4984506_3382.html'}, {'type': 'image/jpeg', 'length': '43663', 'href': 'http://s1.lemde.fr/image/2016/08/18/644x322/4984505_3_babc_ernst-nolte-en-2002-lors-d-un-debat-te_1a50beab88272af4e5a2fb9a2f29cce6.jpg', 'rel': 'enclosure'}]",http://www.lemonde.fr/disparitions/article/2016/08/18/mort-de-l-historien-allemand-ernst-nolte_4984506_3382.html,Mort de l’historien allemand Ernst Nolte,"{'type': 'text/plain', 'language': None, 'base': 'http://web.archive.org/web/20160910180740/http://www.lemonde.fr/disparitions/rss_full.xml', 'value': 'Mort de l’historien allemand Ernst Nolte'}","Historien controversé, il avait cherché à démontrer l’interdépendance entre le communisme, le fascisme et le nazisme. Il disparaît à l’âge de 93 ans.","{'type': 'text/html', 'language': None, 'base': 'http://web.archive.org/web/20160910180740/http://www.lemonde.fr/disparitions/rss_full.xml', 'value': 'Historien controversé, il avait cherché à démontrer l’interdépendance entre le communisme, le fascisme et le nazisme. Il disparaît à l’âge de 93 ans.'}","Thu, 18 Aug 2016 13:16:19 +0200","time.struct_time(tm_year=2016, tm_mon=8, tm_mday=18, tm_hour=11, tm_min=16, tm_sec=19, tm_wday=3, tm_yday=231, tm_isdst=0)",http://www.lemonde.fr/tiny/4984506/,False
"[{'rel': 'alternate', 'type': 'text/html', 'href': 'http://www.lemonde.fr/cinema/article/2016/08/18/mort-du-cineaste-canadien-arthur-hiller-defenseur-passionne-de-la-preservation-du-film_4984187_3476.html'}, {'type': 'image/jpeg', 'length': '31443', 'href': 'http://s2.lemde.fr/image/2016/08/18/644x322/4984185_3_dd94_arthur-hiller-au-centre-lors-de-la-remise-du_3b565ee6c3c1b1d7eafe360035a760ad.jpg', 'rel': 'enclosure'}]",http://www.lemonde.fr/cinema/article/2016/08/18/mort-du-cineaste-canadien-arthur-hiller-defenseur-passionne-de-la-preservation-du-film_4984187_3476.html,"Mort du cinéaste canadien Arthur Hiller, « défenseur passionné de la préservation du film »","{'type': 'text/plain', 'language': None, 'base': 'http://web.archive.org/web/20160910180740/http://www.lemonde.fr/disparitions/rss_full.xml', 'value': 'Mort du cinéaste canadien Arthur Hiller, «\xa0défenseur passionné de la préservation du film\xa0»'}",Le réalisateur de « Love Story » a dirigé le syndicat des réalisateurs de l’industrie américaine du cinéma et l’Académie des Oscars. Il avait 92 ans.,"{'type': 'text/html', 'language': None, 'base': 'http://web.archive.org/web/20160910180740/http://www.lemonde.fr/disparitions/rss_full.xml', 'value': 'Le réalisateur de «\xa0Love Story\xa0» a dirigé le syndicat des réalisateurs de l’industrie américaine du cinéma et l’Académie des Oscars. Il avait 92 ans.'}","Thu, 18 Aug 2016 01:09:28 +0200","time.struct_time(tm_year=2016, tm_mon=8, tm_mday=17, tm_hour=23, tm_min=9, tm_sec=28, tm_wday=2, tm_yday=230, tm_isdst=0)",http://www.lemonde.fr/tiny/4984187/,False
