links,link,title,title_detail,summary,summary_detail,published,published_parsed,id,guidislink
"[{'rel': 'alternate', 'type': 'text/html', 'href': 'http://www.lemonde.fr/m-mode/video/2018/03/12/presque-une-histoire-d-amour-quand-hubert-de-givenchy-parlait-d-audrey-hepburn_5269787_4497335.html'}, {'type': 'image/jpeg', 'length': '36392', 'href': 'http://s1.lemde.fr/image/2018/03/12/644x322/5269786_3_30dc_le-couturier-francais-hubert-de-givenchy-avec_bf9a132fc18c16a61be41c0daa843d6f.jpg', 'rel': 'enclosure'}]",http://www.lemonde.fr/m-mode/video/2018/03/12/presque-une-histoire-d-amour-quand-hubert-de-givenchy-parlait-d-audrey-hepburn_5269787_4497335.html,« Presque une histoire d’amour » : quand Hubert de Givenchy parlait d’Audrey Hepburn,"{'type': 'text/plain', 'language': None, 'base': 'http://web.archive.org/web/20180312184012/http://www.lemonde.fr/disparitions/rss_full.xml', 'value': '«\xa0Presque une histoire d’amour\xa0»\xa0: quand Hubert de Givenchy parlait d’Audrey Hepburn'}","Le célèbre couturier français s’est éteint à l’âge 91 ans, le 10 mars 2018, a annoncé son compagnon dans un communiqué.","{'type': 'text/html', 'language': None, 'base': 'http://web.archive.org/web/20180312184012/http://www.lemonde.fr/disparitions/rss_full.xml', 'value': 'Le célèbre couturier français s’est éteint à l’âge 91\xa0ans, le 10\xa0mars 2018, a annoncé son compagnon dans un communiqué.'}","Mon, 12 Mar 2018 18:20:01 +0100","time.struct_time(tm_year=2018, tm_mon=3, tm_mday=12, tm_hour=17, tm_min=20, tm_sec=1, tm_wday=0, tm_yday=71, tm_isdst=0)",http://www.lemonde.fr/tiny/5269787/,False
"[{'rel': 'alternate', 'type': 'text/html', 'href': 'http://www.lemonde.fr/disparitions/article/2018/03/12/le-couturier-hubert-de-givenchy-est-mort-a-l-age-de-91-ans_5269637_3382.html'}, {'type': 'image/jpeg', 'length': '21146', 'href': 'http://s2.lemde.fr/image/2018/03/12/644x322/5269645_3_f5bf_hubert-de-givenchy-dans-les-coulisses-du_53341c0c94c31f54cfc63b363ac1a0b3.jpg', 'rel': 'enclosure'}]",http://www.lemonde.fr/disparitions/article/2018/03/12/le-couturier-hubert-de-givenchy-est-mort-a-l-age-de-91-ans_5269637_3382.html,Le couturier Hubert de Givenchy est mort à l’âge de 91 ans,"{'type': 'text/plain', 'language': None, 'base': 'http://web.archive.org/web/20180312184012/http://www.lemonde.fr/disparitions/rss_full.xml', 'value': 'Le couturier Hubert de Givenchy est mort à l’âge de 91 ans'}",Hubert de Givenchy symbolisait l’élégance à la française. Avec lui disparaît un des derniers grands témoins de l’âge d’or de la haute couture.,"{'type': 'text/html', 'language': None, 'base': 'http://web.archive.org/web/20180312184012/http://www.lemonde.fr/disparitions/rss_full.xml', 'value': 'Hubert de Givenchy symbolisait l’élégance à la française. Avec lui disparaît un des derniers grands témoins de l’âge d’or de la haute couture.'}","Mon, 12 Mar 2018 14:13:29 +0100","time.struct_time(tm_year=2018, tm_mon=3, tm_mday=12, tm_hour=13, tm_min=13, tm_sec=29, tm_wday=0, tm_yday=71, tm_isdst=0)",http://www.lemonde.fr/tiny/5269637/,False
"[{'rel': 'alternate', 'type': 'text/html', 'href': 'http://www.lemonde.fr/disparitions/article/2018/03/08/la-mort-du-pere-jean-dujardin-homme-cle-du-dialogue-judeo-chretien_5267629_3382.html'}, {'type': 'image/jpeg', 'length': '28348', 'href': 'http://s1.lemde.fr/image/2018/03/08/644x322/5267628_3_96a3_le-pere-jean-dujardin-en-2013_df57e197a0d5f5e191bbaf33380836b6.jpg', 'rel': 'enclosure'}]",http://www.lemonde.fr/disparitions/article/2018/03/08/la-mort-du-pere-jean-dujardin-homme-cle-du-dialogue-judeo-chretien_5267629_3382.html,"La mort du père Jean Dujardin, homme-clé du dialogue judéo-chrétien","{'type': 'text/plain', 'language': None, 'base': 'http://web.archive.org/web/20180312184012/http://www.lemonde.fr/disparitions/rss_full.xml', 'value': 'La mort du père Jean Dujardin, homme-clé du dialogue judéo-chrétien'}","Historien entré dans les ordres en 1962, il a œuvré toute sa vie pour rapprocher les religions. Il est décédé le 3 mars à l’âge de 81 ans.","{'type': 'text/html', 'language': None, 'base': 'http://web.archive.org/web/20180312184012/http://www.lemonde.fr/disparitions/rss_full.xml', 'value': 'Historien entré dans les ordres en 1962, il a œuvré toute sa vie pour rapprocher les religions. Il est décédé le 3 mars à l’âge de 81 ans.'}","Thu, 08 Mar 2018 12:21:10 +0100","time.struct_time(tm_year=2018, tm_mon=3, tm_mday=8, tm_hour=11, tm_min=21, tm_sec=10, tm_wday=3, tm_yday=67, tm_isdst=0)",http://www.lemonde.fr/tiny/5267629/,False
"[{'rel': 'alternate', 'type': 'text/html', 'href': 'http://www.lemonde.fr/disparitions/article/2018/03/07/deces-du-sinologue-jacques-gernet_5267132_3382.html'}, {'type': 'image/jpeg', 'length': '24507', 'href': 'http://s2.lemde.fr/image/2018/03/07/644x322/5267131_3_a177_jacques-gernet-sinologue-et-professeur_3917b0f19928b5024198f16280a7c639.jpg', 'rel': 'enclosure'}]",http://www.lemonde.fr/disparitions/article/2018/03/07/deces-du-sinologue-jacques-gernet_5267132_3382.html,Décès du sinologue Jacques Gernet,"{'type': 'text/plain', 'language': None, 'base': 'http://web.archive.org/web/20180312184012/http://www.lemonde.fr/disparitions/rss_full.xml', 'value': 'Décès du sinologue Jacques Gernet'}","Le professeur émérite au Collège de France et membre de l’Institut de France, qui aura marqué l’histoire de sa discipline, est mort le 3 mars à l’âge de 96 ans","{'type': 'text/html', 'language': None, 'base': 'http://web.archive.org/web/20180312184012/http://www.lemonde.fr/disparitions/rss_full.xml', 'value': 'Le professeur émérite au Collège de France et membre de l’Institut de France, qui aura marqué l’histoire de sa discipline, est mort le 3\xa0mars à l’âge de 96 ans'}","Wed, 07 Mar 2018 15:56:19 +0100","time.struct_time(tm_year=2018, tm_mon=3, tm_mday=7, tm_hour=14, tm_min=56, tm_sec=19, tm_wday=2, tm_yday=66, tm_isdst=0)",http://www.lemonde.fr/tiny/5267132/,False
"[{'rel': 'alternate', 'type': 'text/html', 'href': 'http://www.lemonde.fr/disparitions/article/2018/03/05/andre-s-labarthe-la-passion-du-desordre_5266118_3382.html'}, {'type': 'image/jpeg', 'length': '29952', 'href': 'http://s1.lemde.fr/image/2018/03/07/644x322/5267176_3_81cc_amoureux-fou-de-la-litterature-inventeur-de_362ca2de6af0542b7f98d1c703eefc5e.jpg', 'rel': 'enclosure'}]",http://www.lemonde.fr/disparitions/article/2018/03/05/andre-s-labarthe-la-passion-du-desordre_5266118_3382.html,"André S. Labarthe, la passion du désordre","{'type': 'text/plain', 'language': None, 'base': 'http://web.archive.org/web/20180312184012/http://www.lemonde.fr/disparitions/rss_full.xml', 'value': 'André S.\xa0Labarthe, la passion du désordre'}","Critique, cinéaste, producteur, figure de la cinéphilie française, il est mort lundi 5 mars à Paris, à l’âge de 86 ans.","{'type': 'text/html', 'language': None, 'base': 'http://web.archive.org/web/20180312184012/http://www.lemonde.fr/disparitions/rss_full.xml', 'value': 'Critique, cinéaste, producteur, figure de la cinéphilie française, il est mort lundi 5\xa0mars à Paris, à l’âge de 86 ans.'}","Mon, 05 Mar 2018 19:17:58 +0100","time.struct_time(tm_year=2018, tm_mon=3, tm_mday=5, tm_hour=18, tm_min=17, tm_sec=58, tm_wday=0, tm_yday=64, tm_isdst=0)",http://www.lemonde.fr/tiny/5266118/,False
"[{'rel': 'alternate', 'type': 'text/html', 'href': 'http://www.lemonde.fr/disparitions/article/2018/03/04/athletisme-mort-de-roger-bannister-qui-courut-le-mile-en-moins-de-quatre-minutes-en-1954_5265502_3382.html'}, {'type': 'image/jpeg', 'length': '24648', 'href': 'http://s2.lemde.fr/image/2018/03/04/644x322/5265501_3_94d8_le-record-de-roger-bannister-ne-tint-que-six_352fd8aaf2420ed0c1c8e58cdee57996.jpg', 'rel': 'enclosure'}]",http://www.lemonde.fr/disparitions/article/2018/03/04/athletisme-mort-de-roger-bannister-qui-courut-le-mile-en-moins-de-quatre-minutes-en-1954_5265502_3382.html,"Athlétisme : mort de Roger Bannister, qui courut le « mile » en moins de 4 minutes en 1954","{'type': 'text/plain', 'language': None, 'base': 'http://web.archive.org/web/20180312184012/http://www.lemonde.fr/disparitions/rss_full.xml', 'value': 'Athlétisme : mort de Roger Bannister, qui courut le «\xa0mile\xa0» en moins de 4\xa0minutes en 1954'}","La performance de l’athlète britannique eut un tel impact symbolique qu’elle provoqua une interruption de séance à la Chambre des communes, à Londres.","{'type': 'text/html', 'language': None, 'base': 'http://web.archive.org/web/20180312184012/http://www.lemonde.fr/disparitions/rss_full.xml', 'value': 'La performance de l’athlète britannique eut un tel impact symbolique qu’elle provoqua une interruption de séance à la Chambre des communes, à Londres.'}","Sun, 04 Mar 2018 14:17:40 +0100","time.struct_time(tm_year=2018, tm_mon=3, tm_mday=4, tm_hour=13, tm_min=17, tm_sec=40, tm_wday=6, tm_yday=63, tm_isdst=0)",http://www.lemonde.fr/tiny/5265502/,False
"[{'rel': 'alternate', 'type': 'text/html', 'href': 'http://www.lemonde.fr/disparitions/article/2018/03/04/football-davide-astori-le-capitaine-de-la-fiorentina-meurt-subitement-a-l-age-de-31-ans_5265494_3382.html'}, {'type': 'image/jpeg', 'length': '37057', 'href': 'http://s1.lemde.fr/image/2018/03/04/644x322/5265492_3_c6d2_forme-a-l-ac-milan-astori-a-porte-les-mail_6eeddb327f48e853167a6b535feb0089.jpg', 'rel': 'enclosure'}]",http://www.lemonde.fr/disparitions/article/2018/03/04/football-davide-astori-le-capitaine-de-la-fiorentina-meurt-subitement-a-l-age-de-31-ans_5265494_3382.html,"Football : Davide Astori, le capitaine de la Fiorentina, meurt subitement à l’âge de 31 ans","{'type': 'text/plain', 'language': None, 'base': 'http://web.archive.org/web/20180312184012/http://www.lemonde.fr/disparitions/rss_full.xml', 'value': 'Football\xa0: Davide Astori, le capitaine de la Fiorentina, meurt subitement à l’âge de 31 ans'}","Le joueur est mort de causes naturelles, selon le procureur d’Udine, où le footballeur s’est éteint à la veille d’un match.","{'type': 'text/html', 'language': None, 'base': 'http://web.archive.org/web/20180312184012/http://www.lemonde.fr/disparitions/rss_full.xml', 'value': 'Le joueur est mort de causes naturelles, selon le procureur d’Udine, où le footballeur s’est éteint à la veille d’un match.'}","Sun, 04 Mar 2018 12:54:10 +0100","time.struct_time(tm_year=2018, tm_mon=3, tm_mday=4, tm_hour=11, tm_min=54, tm_sec=10, tm_wday=6, tm_yday=63, tm_isdst=0)",http://www.lemonde.fr/tiny/5265494/,False
"[{'rel': 'alternate', 'type': 'text/html', 'href': 'http://www.lemonde.fr/disparitions/article/2018/03/03/le-comedien-marcel-philippot-star-de-la-serie-palace-est-mort_5265314_3382.html'}, {'type': 'image/jpeg', 'length': '32922', 'href': 'http://s2.lemde.fr/image/2018/03/03/644x322/5265311_3_d2fd_marcel-philippot-a-droite-en-2005_de787384c40b6ed6208c21dd7b41d7fe.jpg', 'rel': 'enclosure'}]",http://www.lemonde.fr/disparitions/article/2018/03/03/le-comedien-marcel-philippot-star-de-la-serie-palace-est-mort_5265314_3382.html,"Le comédien Marcel Philippot, star de la série « Palace », est mort","{'type': 'text/plain', 'language': None, 'base': 'http://web.archive.org/web/20180312184012/http://www.lemonde.fr/disparitions/rss_full.xml', 'value': 'Le comédien Marcel Philippot, star de la série «\xa0Palace\xa0», est mort'}","Comédien de théâtre, de cinéma et de télévision, formé au Conservatoire de Paris, il a joué des dizaines de seconds rôles.","{'type': 'text/html', 'language': None, 'base': 'http://web.archive.org/web/20180312184012/http://www.lemonde.fr/disparitions/rss_full.xml', 'value': 'Comédien de théâtre, de cinéma et de télévision, formé au Conservatoire de Paris, il a joué des dizaines de seconds rôles.'}","Sat, 03 Mar 2018 15:49:54 +0100","time.struct_time(tm_year=2018, tm_mon=3, tm_mday=3, tm_hour=14, tm_min=49, tm_sec=54, tm_wday=5, tm_yday=62, tm_isdst=0)",http://www.lemonde.fr/tiny/5265314/,False
"[{'rel': 'alternate', 'type': 'text/html', 'href': 'http://www.lemonde.fr/musiques/article/2018/03/03/disparition-d-un-grand-d-espagne-le-chef-d-orchestre-jesus-lopez-cobos_5265164_1654986.html'}, {'type': 'image/jpeg', 'length': '34404', 'href': 'http://s1.lemde.fr/image/2018/03/03/644x322/5265163_3_5508_le-chef-d-orchestre-jesus-lopez-cobos-a-mi_883aa4d71a0a434c63d08d61730aed2c.jpg', 'rel': 'enclosure'}]",http://www.lemonde.fr/musiques/article/2018/03/03/disparition-d-un-grand-d-espagne-le-chef-d-orchestre-jesus-lopez-cobos_5265164_1654986.html,"Un grand d’Espagne, le chef d’orchestre Jesus Lopez Cobos, est mort","{'type': 'text/plain', 'language': None, 'base': 'http://web.archive.org/web/20180312184012/http://www.lemonde.fr/disparitions/rss_full.xml', 'value': 'Un grand d’Espagne, le chef d’orchestre Jesus Lopez Cobos, est mort'}","Le maestro s’est éteint à Berlin le 2 mars, à 78 ans, des suites d’un cancer.","{'type': 'text/html', 'language': None, 'base': 'http://web.archive.org/web/20180312184012/http://www.lemonde.fr/disparitions/rss_full.xml', 'value': 'Le maestro s’est éteint à Berlin le 2 mars, à 78 ans, des suites d’un cancer.'}","Sat, 03 Mar 2018 09:35:33 +0100","time.struct_time(tm_year=2018, tm_mon=3, tm_mday=3, tm_hour=8, tm_min=35, tm_sec=33, tm_wday=5, tm_yday=62, tm_isdst=0)",http://www.lemonde.fr/tiny/5265164/,False
"[{'rel': 'alternate', 'type': 'text/html', 'href': 'http://www.lemonde.fr/disparitions/article/2018/03/02/le-poete-japonais-tota-kaneko-est-mort_5264871_3382.html'}, {'type': 'image/jpeg', 'length': '40394', 'href': 'http://s2.lemde.fr/image/2018/03/02/644x322/5264869_3_8399_le-poete-japonais-tota-kaneko-en-octobre-2017_9c0cac72b8469d5e4b4714a3ca988e9c.jpg', 'rel': 'enclosure'}]",http://www.lemonde.fr/disparitions/article/2018/03/02/le-poete-japonais-tota-kaneko-est-mort_5264871_3382.html,Le poète japonais Tota Kaneko est mort,"{'type': 'text/plain', 'language': None, 'base': 'http://web.archive.org/web/20180312184012/http://www.lemonde.fr/disparitions/rss_full.xml', 'value': 'Le poète japonais Tota Kaneko est mort'}","Grande figure du haïku, poésie qu’il contribua à renouveler, Tota Kaneko est mort le 20 février, à l’âge de 98 ans","{'type': 'text/html', 'language': None, 'base': 'http://web.archive.org/web/20180312184012/http://www.lemonde.fr/disparitions/rss_full.xml', 'value': 'Grande figure du haïku, poésie qu’il contribua à renouveler, Tota Kaneko est mort le 20\xa0février, à l’âge de 98 ans'}","Fri, 02 Mar 2018 15:07:25 +0100","time.struct_time(tm_year=2018, tm_mon=3, tm_mday=2, tm_hour=14, tm_min=7, tm_sec=25, tm_wday=4, tm_yday=61, tm_isdst=0)",http://www.lemonde.fr/tiny/5264871/,False
"[{'rel': 'alternate', 'type': 'text/html', 'href': 'http://www.lemonde.fr/disparitions/article/2018/03/02/tota-kaneko-en-5-dates_5264867_3382.html'}]",http://www.lemonde.fr/disparitions/article/2018/03/02/tota-kaneko-en-5-dates_5264867_3382.html,Tota Kaneko en 5 dates,"{'type': 'text/plain', 'language': None, 'base': 'http://web.archive.org/web/20180312184012/http://www.lemonde.fr/disparitions/rss_full.xml', 'value': 'Tota Kaneko en 5 dates'}",,"{'type': 'text/html', 'language': None, 'base': 'http://web.archive.org/web/20180312184012/http://www.lemonde.fr/disparitions/rss_full.xml', 'value': ''}","Fri, 02 Mar 2018 15:05:46 +0100","time.struct_time(tm_year=2018, tm_mon=3, tm_mday=2, tm_hour=14, tm_min=5, tm_sec=46, tm_wday=4, tm_yday=61, tm_isdst=0)",http://www.lemonde.fr/tiny/5264867/,False
"[{'rel': 'alternate', 'type': 'text/html', 'href': 'http://www.lemonde.fr/afrique/article/2018/03/02/la-negritude-n-aurait-pas-connu-un-tel-eclat-sans-lilyan-kesteloot_5264613_3212.html'}, {'type': 'image/jpeg', 'length': '16466', 'href': 'http://s1.lemde.fr/image/2018/03/02/644x322/5264611_3_a49d_lilyan-kesteloot-specialiste-de-la_99755f1482eeafb0479a35931e1db8c4.jpg', 'rel': 'enclosure'}]",http://www.lemonde.fr/afrique/article/2018/03/02/la-negritude-n-aurait-pas-connu-un-tel-eclat-sans-lilyan-kesteloot_5264613_3212.html,« La négritude n’aurait pas connu un tel éclat sans Lilyan Kesteloot »,"{'type': 'text/plain', 'language': None, 'base': 'http://web.archive.org/web/20180312184012/http://www.lemonde.fr/disparitions/rss_full.xml', 'value': '«\xa0La négritude n’aurait pas connu un tel éclat sans Lilyan Kesteloot\xa0»'}","Notre chroniqueur rend hommage à la chercheuse belge, disparue le 28 février, dont la carrière se confond avec l’histoire de la littérature africaine.","{'type': 'text/html', 'language': None, 'base': 'http://web.archive.org/web/20180312184012/http://www.lemonde.fr/disparitions/rss_full.xml', 'value': 'Notre chroniqueur rend hommage à la chercheuse belge, disparue le 28\xa0février, dont la carrière se confond avec l’histoire de la littérature africaine.'}","Fri, 02 Mar 2018 10:33:16 +0100","time.struct_time(tm_year=2018, tm_mon=3, tm_mday=2, tm_hour=9, tm_min=33, tm_sec=16, tm_wday=4, tm_yday=61, tm_isdst=0)",http://www.lemonde.fr/tiny/5264613/,False
"[{'rel': 'alternate', 'type': 'text/html', 'href': 'http://www.lemonde.fr/idees/article/2018/03/02/johnny-hallyday-son-heritage-et-le-mythe-de-la-veuve-abusive_5264512_3232.html'}, {'type': 'image/jpeg', 'length': '40946', 'href': 'http://s2.lemde.fr/image/2018/03/02/644x322/5264510_3_a534_hommage-au-chanteur-johnny-hallyday-lors-de-la_bcbe58a5fea49d635c028a18a4b61ee3.jpg', 'rel': 'enclosure'}]",http://www.lemonde.fr/idees/article/2018/03/02/johnny-hallyday-son-heritage-et-le-mythe-de-la-veuve-abusive_5264512_3232.html,"Johnny Hallyday, son héritage et le mythe de la « veuve abusive »","{'type': 'text/plain', 'language': None, 'base': 'http://web.archive.org/web/20180312184012/http://www.lemonde.fr/disparitions/rss_full.xml', 'value': 'Johnny Hallyday, son héritage et le mythe de la «\xa0veuve abusive\xa0»'}","Dans sa chronique, Michel Guerrin, rédacteur en chef au « Monde », évoque la veuve abusive, un profil bien connu dans l’imaginaire collectif.","{'type': 'text/html', 'language': None, 'base': 'http://web.archive.org/web/20180312184012/http://www.lemonde.fr/disparitions/rss_full.xml', 'value': 'Dans sa chronique, Michel Guerrin, rédacteur en chef au «\xa0Monde\xa0», évoque la veuve abusive, un profil bien connu dans l’imaginaire collectif.'}","Fri, 02 Mar 2018 06:36:45 +0100","time.struct_time(tm_year=2018, tm_mon=3, tm_mday=2, tm_hour=5, tm_min=36, tm_sec=45, tm_wday=4, tm_yday=61, tm_isdst=0)",http://www.lemonde.fr/tiny/5264512/,False
"[{'rel': 'alternate', 'type': 'text/html', 'href': 'http://www.lemonde.fr/disparitions/article/2018/03/01/la-mort-de-l-historien-pierre-milza_5264312_3382.html'}, {'type': 'image/jpeg', 'length': '42709', 'href': 'http://s1.lemde.fr/image/2018/03/01/644x322/5264310_3_578e_pierre-milza-en-2002_182ff9e385ac5c7eea8332df691dd421.jpg', 'rel': 'enclosure'}]",http://www.lemonde.fr/disparitions/article/2018/03/01/la-mort-de-l-historien-pierre-milza_5264312_3382.html,L’historien Pierre Milza est mort,"{'type': 'text/plain', 'language': None, 'base': 'http://web.archive.org/web/20180312184012/http://www.lemonde.fr/disparitions/rss_full.xml', 'value': 'L’historien Pierre Milza est mort'}","Considéré comme l’un des meilleurs spécialistes du fascisme et de l’Italie du XIXe et XXe siècles, célèbre entre autres pour ses ouvrages cosignés avec Serge Berstein, Pierre Milza est mort le 28 février, à l’âge de 85 ans.","{'type': 'text/html', 'language': None, 'base': 'http://web.archive.org/web/20180312184012/http://www.lemonde.fr/disparitions/rss_full.xml', 'value': 'Considéré comme l’un des meilleurs spécialistes du fascisme et de l’Italie du XIXe et XXe\xa0siècles, célèbre entre autres pour ses ouvrages cosignés avec Serge Berstein, Pierre Milza est mort le 28\xa0février, à l’âge de 85 ans.'}","Thu, 01 Mar 2018 14:29:15 +0100","time.struct_time(tm_year=2018, tm_mon=3, tm_mday=1, tm_hour=13, tm_min=29, tm_sec=15, tm_wday=3, tm_yday=60, tm_isdst=0)",http://www.lemonde.fr/tiny/5264312/,False
"[{'rel': 'alternate', 'type': 'text/html', 'href': 'http://www.lemonde.fr/disparitions/article/2018/03/01/le-cineaste-franco-argentin-hugo-santiago-est-mort_5264127_3382.html'}, {'type': 'image/jpeg', 'length': '26664', 'href': 'http://s2.lemde.fr/image/2018/03/01/644x322/5264126_3_60f7_le-cineaste-franco-argentin-hugo-santiago_ced3ab1dcbe57ee202dc66c49b2207ab.jpg', 'rel': 'enclosure'}]",http://www.lemonde.fr/disparitions/article/2018/03/01/le-cineaste-franco-argentin-hugo-santiago-est-mort_5264127_3382.html,Le cinéaste franco-argentin Hugo Santiago est mort,"{'type': 'text/plain', 'language': None, 'base': 'http://web.archive.org/web/20180312184012/http://www.lemonde.fr/disparitions/rss_full.xml', 'value': 'Le cinéaste franco-argentin Hugo Santiago est mort'}","Réalisateur de films cultes, il est, entre autres, l’auteur d’« Invasion » présenté au Festival de Cannes en 1969.","{'type': 'text/html', 'language': None, 'base': 'http://web.archive.org/web/20180312184012/http://www.lemonde.fr/disparitions/rss_full.xml', 'value': 'Réalisateur de films cultes, il est, entre autres, l’auteur d’«\xa0Invasion\xa0» présenté au Festival de Cannes en\xa01969.'}","Thu, 01 Mar 2018 10:32:29 +0100","time.struct_time(tm_year=2018, tm_mon=3, tm_mday=1, tm_hour=9, tm_min=32, tm_sec=29, tm_wday=3, tm_yday=60, tm_isdst=0)",http://www.lemonde.fr/tiny/5264127/,False
"[{'rel': 'alternate', 'type': 'text/html', 'href': 'http://www.lemonde.fr/disparitions/article/2018/02/28/l-historien-pierre-milza-est-mort_5263833_3382.html'}, {'type': 'image/jpeg', 'length': '43197', 'href': 'http://s1.lemde.fr/image/2018/02/28/644x322/5263832_3_ecbd_portrait-de-l-historien-pierre-milza-pris-le-30_5afd3cd804fb6c7fa0ed0e49487a4650.jpg', 'rel': 'enclosure'}]",http://www.lemonde.fr/disparitions/article/2018/02/28/l-historien-pierre-milza-est-mort_5263833_3382.html,L’historien Pierre Milza est mort,"{'type': 'text/plain', 'language': None, 'base': 'http://web.archive.org/web/20180312184012/http://www.lemonde.fr/disparitions/rss_full.xml', 'value': 'L’historien Pierre Milza est mort'}","Agrégé d’histoire, Pierre Milza avait consacré sa thèse aux relations franco-italiennes à la fin du XIXe et au début du XXe siècle.","{'type': 'text/html', 'language': None, 'base': 'http://web.archive.org/web/20180312184012/http://www.lemonde.fr/disparitions/rss_full.xml', 'value': 'Agrégé d’histoire, Pierre Milza avait consacré sa thèse aux relations franco-italiennes à la fin du XIXe et au début du XXe\xa0siècle.'}","Wed, 28 Feb 2018 17:49:08 +0100","time.struct_time(tm_year=2018, tm_mon=2, tm_mday=28, tm_hour=16, tm_min=49, tm_sec=8, tm_wday=2, tm_yday=59, tm_isdst=0)",http://www.lemonde.fr/tiny/5263833/,False
"[{'rel': 'alternate', 'type': 'text/html', 'href': 'http://www.lemonde.fr/disparitions/article/2018/02/28/mort-de-bernard-lesfargues-poete-et-traducteur_5263663_3382.html'}, {'type': 'image/jpeg', 'length': '41205', 'href': 'http://s2.lemde.fr/image/2018/02/28/644x322/5263662_3_c10c_bernard-lesfargues_7524cccb350ebfa5196ff0096333c23a.jpg', 'rel': 'enclosure'}]",http://www.lemonde.fr/disparitions/article/2018/02/28/mort-de-bernard-lesfargues-poete-et-traducteur_5263663_3382.html,"Bernard Lesfargues, poète et traducteur, est mort","{'type': 'text/plain', 'language': None, 'base': 'http://web.archive.org/web/20180312184012/http://www.lemonde.fr/disparitions/rss_full.xml', 'value': 'Bernard Lesfargues, poète et traducteur, est mort'}","Ce défenseur des langues minoritaires a traduit et édité de nombreux auteurs occitans, catalans et espagnols.","{'type': 'text/html', 'language': None, 'base': 'http://web.archive.org/web/20180312184012/http://www.lemonde.fr/disparitions/rss_full.xml', 'value': 'Ce défenseur des langues minoritaires a traduit et édité de nombreux auteurs occitans, catalans et espagnols.'}","Wed, 28 Feb 2018 12:18:44 +0100","time.struct_time(tm_year=2018, tm_mon=2, tm_mday=28, tm_hour=11, tm_min=18, tm_sec=44, tm_wday=2, tm_yday=59, tm_isdst=0)",http://www.lemonde.fr/tiny/5263663/,False
"[{'rel': 'alternate', 'type': 'text/html', 'href': 'http://www.lemonde.fr/disparitions/article/2018/02/27/mort-du-photojournaliste-laurent-troude_5263279_3382.html'}, {'type': 'image/jpeg', 'length': '25879', 'href': 'http://s1.lemde.fr/image/2018/02/27/644x322/5263278_3_2690_a-paris-en-2017_c1b5acf39f16ca7831a5f690c4e96f44.jpg', 'rel': 'enclosure'}]",http://www.lemonde.fr/disparitions/article/2018/02/27/mort-du-photojournaliste-laurent-troude_5263279_3382.html,Mort du photojournaliste Laurent Troude,"{'type': 'text/plain', 'language': None, 'base': 'http://web.archive.org/web/20180312184012/http://www.lemonde.fr/disparitions/rss_full.xml', 'value': 'Mort du photojournaliste Laurent Troude'}","Il couvrait depuis plus de vingt ans la vie politique pour le quotidien « Libération » : le photographe de presse Laurent Troude est mort, samedi 24 février, à l’âge de 50 ans.","{'type': 'text/html', 'language': None, 'base': 'http://web.archive.org/web/20180312184012/http://www.lemonde.fr/disparitions/rss_full.xml', 'value': 'Il couvrait depuis plus de vingt ans la vie politique pour le quotidien «\xa0Libération\xa0»\xa0: le photographe de presse Laurent Troude est mort, samedi 24\xa0février, à l’âge de 50 ans.'}","Tue, 27 Feb 2018 16:42:39 +0100","time.struct_time(tm_year=2018, tm_mon=2, tm_mday=27, tm_hour=15, tm_min=42, tm_sec=39, tm_wday=1, tm_yday=58, tm_isdst=0)",http://www.lemonde.fr/tiny/5263279/,False
