title,title_detail,published,published_parsed,summary,summary_detail,id,guidislink,link,links,media_content,content,media_credit,credit
"Pierre Troisgros, célèbre chef étoilé, est mort","{'type': 'text/plain', 'language': None, 'base': 'http://web.archive.org/web/20201004215429/https://www.lemonde.fr/disparitions/rss_full.xml', 'value': 'Pierre Troisgros, célèbre chef étoilé, est mort'}","Wed, 23 Sep 2020 17:30:40 +0200","time.struct_time(tm_year=2020, tm_mon=9, tm_mday=23, tm_hour=15, tm_min=30, tm_sec=40, tm_wday=2, tm_yday=267, tm_isdst=0)","Le chef roannais triplement étoilé est mort mercredi, à l’âge de 92 ans. Celui qui a pris la suite de son père dans les années 1950, avec son frère Jean, a hissé la Maison Troisgros au rang de monument de la gastronomie.","{'type': 'text/html', 'language': None, 'base': 'http://web.archive.org/web/20201004215429/https://www.lemonde.fr/disparitions/rss_full.xml', 'value': 'Le chef roannais triplement étoilé est mort mercredi, à l’âge de 92\xa0ans. Celui qui a pris la suite de son père dans les années 1950, avec son frère Jean, a hissé la Maison Troisgros au rang de monument de la gastronomie.'}",https://www.lemonde.fr/disparitions/article/2020/09/23/pierre-troisgros-celebre-chef-etoile-est-mort_6053339_3382.html,True,https://www.lemonde.fr/disparitions/article/2020/09/23/pierre-troisgros-celebre-chef-etoile-est-mort_6053339_3382.html,"[{'rel': 'alternate', 'type': 'text/html', 'href': 'https://www.lemonde.fr/disparitions/article/2020/09/23/pierre-troisgros-celebre-chef-etoile-est-mort_6053339_3382.html'}]","[{'url': 'https://img.lemde.fr/2020/09/23/67/0/5543/2769/644/322/60/0/025562b_498945877-000-8qk3lg.jpg', 'width': '644', 'height': '322'}]","[{'type': 'text/plain', 'language': None, 'base': 'http://web.archive.org/web/20201004215429/https://www.lemonde.fr/disparitions/rss_full.xml', 'value': 'Les chefs Paul Bocuse, Pierre Troisgros, Jacques Pic, Georges Blanc et Alain Chapel en 1983.'}]","[{'scheme': 'urn:ebu', 'content': 'EDMOND PINAUD / AFP'}]",EDMOND PINAUD / AFP
La mort de l’archéologue Yvette Taborin,"{'type': 'text/plain', 'language': None, 'base': 'http://web.archive.org/web/20201004215429/https://www.lemonde.fr/disparitions/rss_full.xml', 'value': 'La mort de l’archéologue Yvette Taborin'}","Wed, 23 Sep 2020 13:11:57 +0200","time.struct_time(tm_year=2020, tm_mon=9, tm_mday=23, tm_hour=11, tm_min=11, tm_sec=57, tm_wday=2, tm_yday=267, tm_isdst=0)","Professeure d’archéologie préhistorique, spécialiste de l’étude des parures paléolithiques, elle fut responsable pendant près de trente ans des fouilles de l’important site d’Etiolles (Essonne). Elle est morte le 8 septembre, à l’âge de 91 ans.","{'type': 'text/html', 'language': None, 'base': 'http://web.archive.org/web/20201004215429/https://www.lemonde.fr/disparitions/rss_full.xml', 'value': 'Professeure d’archéologie préhistorique, spécialiste de l’étude des parures paléolithiques, elle fut responsable pendant près de trente ans des fouilles de l’important site d’Etiolles (Essonne). Elle est morte le 8 septembre, à l’âge de 91 ans.'}",https://www.lemonde.fr/disparitions/article/2020/09/23/la-mort-de-l-archeologue-yvette-taborin_6053319_3382.html,True,https://www.lemonde.fr/disparitions/article/2020/09/23/la-mort-de-l-archeologue-yvette-taborin_6053319_3382.html,"[{'rel': 'alternate', 'type': 'text/html', 'href': 'https://www.lemonde.fr/disparitions/article/2020/09/23/la-mort-de-l-archeologue-yvette-taborin_6053319_3382.html'}]","[{'url': 'https://img.lemde.fr/2020/09/23/104/0/1000/499/644/322/60/0/5db49a8_759340236-taborin.jpg', 'width': '644', 'height': '322'}]","[{'type': 'text/plain', 'language': None, 'base': 'http://web.archive.org/web/20201004215429/https://www.lemonde.fr/disparitions/rss_full.xml', 'value': 'Yvette Taborin.'}]","[{'scheme': 'urn:ebu', 'content': 'collection particulière'}]",collection particulière
Mort de la journaliste italienne Rossana Rossanda,"{'type': 'text/plain', 'language': None, 'base': 'http://web.archive.org/web/20201004215429/https://www.lemonde.fr/disparitions/rss_full.xml', 'value': 'Mort de la journaliste italienne Rossana Rossanda'}","Wed, 23 Sep 2020 11:23:51 +0200","time.struct_time(tm_year=2020, tm_mon=9, tm_mday=23, tm_hour=9, tm_min=23, tm_sec=51, tm_wday=2, tm_yday=267, tm_isdst=0)","La fondatrice du quotidien « Il Manifesto » est morte à Rome le 20 septembre, à l’âge de 96 ans.","{'type': 'text/html', 'language': None, 'base': 'http://web.archive.org/web/20201004215429/https://www.lemonde.fr/disparitions/rss_full.xml', 'value': 'La fondatrice du quotidien «\xa0Il Manifesto\xa0» est morte à Rome le 20 septembre, à l’âge de 96\xa0ans.'}",https://www.lemonde.fr/disparitions/article/2020/09/23/mort-de-la-journaliste-italienne-rossana-rossanda_6053295_3382.html,True,https://www.lemonde.fr/disparitions/article/2020/09/23/mort-de-la-journaliste-italienne-rossana-rossanda_6053295_3382.html,"[{'rel': 'alternate', 'type': 'text/html', 'href': 'https://www.lemonde.fr/disparitions/article/2020/09/23/mort-de-la-journaliste-italienne-rossana-rossanda_6053295_3382.html'}]","[{'url': 'https://img.lemde.fr/2020/09/23/1348/0/2043/1019/644/322/60/0/26a61b9_518558482-h-00518480.jpg', 'width': '644', 'height': '322'}]","[{'type': 'text/plain', 'language': None, 'base': 'http://web.archive.org/web/20201004215429/https://www.lemonde.fr/disparitions/rss_full.xml', 'value': 'Rossana Rossanda, en 1984.'}]","[{'scheme': 'urn:ebu', 'content': 'ANGELO PALMA/A3/CONTRASTO'}]",ANGELO PALMA/A3/CONTRASTO
L’acteur franco-britannique Michael Lonsdale est mort,"{'type': 'text/plain', 'language': None, 'base': 'http://web.archive.org/web/20201004215429/https://www.lemonde.fr/disparitions/rss_full.xml', 'value': 'L’acteur franco-britannique Michael Lonsdale est mort'}","Mon, 21 Sep 2020 16:21:30 +0200","time.struct_time(tm_year=2020, tm_mon=9, tm_mday=21, tm_hour=14, tm_min=21, tm_sec=30, tm_wday=0, tm_yday=265, tm_isdst=0)","Le comédien, qui a brillé aussi bien au théâtre qu’au cinéma, notamment chez Buñuel, Duras, Welles, Costa-Gavras ou Beauvois, est mort lundi à l’âge de 89 ans.","{'type': 'text/html', 'language': None, 'base': 'http://web.archive.org/web/20201004215429/https://www.lemonde.fr/disparitions/rss_full.xml', 'value': 'Le comédien, qui a brillé aussi bien au théâtre qu’au cinéma, notamment chez Buñuel, Duras, Welles, Costa-Gavras ou Beauvois, est mort lundi à l’âge de 89\xa0ans.'}",https://www.lemonde.fr/disparitions/article/2020/09/21/l-acteur-franco-britannique-michael-lonsdale-est-mort_6053058_3382.html,True,https://www.lemonde.fr/disparitions/article/2020/09/21/l-acteur-franco-britannique-michael-lonsdale-est-mort_6053058_3382.html,"[{'rel': 'alternate', 'type': 'text/html', 'href': 'https://www.lemonde.fr/disparitions/article/2020/09/21/l-acteur-franco-britannique-michael-lonsdale-est-mort_6053058_3382.html'}]","[{'url': 'https://img.lemde.fr/2020/09/21/314/0/2480/1238/644/322/60/0/5091c77_693671892-divergence-oro0475001.jpg', 'width': '644', 'height': '322'}]","[{'type': 'text/plain', 'language': None, 'base': 'http://web.archive.org/web/20201004215429/https://www.lemonde.fr/disparitions/rss_full.xml', 'value': 'L’acteur Michael Lonsdale, en 2008 à Paris.'}]","[{'scheme': 'urn:ebu', 'content': 'OLIVIER ROLLER / DIVERGENCE'}]",OLIVIER ROLLER / DIVERGENCE
Mort du juriste et philosophe Bernard Edelman,"{'type': 'text/plain', 'language': None, 'base': 'http://web.archive.org/web/20201004215429/https://www.lemonde.fr/disparitions/rss_full.xml', 'value': 'Mort du juriste et philosophe Bernard Edelman'}","Mon, 21 Sep 2020 13:07:02 +0200","time.struct_time(tm_year=2020, tm_mon=9, tm_mday=21, tm_hour=11, tm_min=7, tm_sec=2, tm_wday=0, tm_yday=265, tm_isdst=0)","Avocat, spécialiste international du droit d’auteur et des questions soulevées par la propriété intellectuelle, il est aussi l’auteur d’une œuvre importante installée à la frontière du droit et de la philosophie. Il est mort le 3 septembre, à l’âge de 82 ans.","{'type': 'text/html', 'language': None, 'base': 'http://web.archive.org/web/20201004215429/https://www.lemonde.fr/disparitions/rss_full.xml', 'value': 'Avocat, spécialiste international du droit d’auteur et des questions soulevées par la propriété intellectuelle, il est aussi l’auteur d’une œuvre importante installée à la frontière du droit et de la philosophie. Il est mort le 3 septembre, à l’âge de 82 ans.'}",https://www.lemonde.fr/disparitions/article/2020/09/21/mort-du-juriste-et-philosophe-bernard-edelman_6053041_3382.html,True,https://www.lemonde.fr/disparitions/article/2020/09/21/mort-du-juriste-et-philosophe-bernard-edelman_6053041_3382.html,"[{'rel': 'alternate', 'type': 'text/html', 'href': 'https://www.lemonde.fr/disparitions/article/2020/09/21/mort-du-juriste-et-philosophe-bernard-edelman_6053041_3382.html'}]","[{'url': 'https://img.lemde.fr/2020/09/21/330/0/1242/621/644/322/60/0/60e2f42_32742768-image1.jpeg', 'width': '644', 'height': '322'}]","[{'type': 'text/plain', 'language': None, 'base': 'http://web.archive.org/web/20201004215429/https://www.lemonde.fr/disparitions/rss_full.xml', 'value': 'Le juriste et philosophe Bernard Edelman.'}]","[{'scheme': 'urn:ebu', 'content': 'Archive familiale'}]",Archive familiale
"La mort d’Alain Woodrow, ancien journaliste au « Monde »","{'type': 'text/plain', 'language': None, 'base': 'http://web.archive.org/web/20201004215429/https://www.lemonde.fr/disparitions/rss_full.xml', 'value': 'La mort d’Alain Woodrow, ancien journaliste au «\xa0Monde\xa0»'}","Sun, 20 Sep 2020 15:56:19 +0200","time.struct_time(tm_year=2020, tm_mon=9, tm_mday=20, tm_hour=13, tm_min=56, tm_sec=19, tm_wday=6, tm_yday=264, tm_isdst=0)","Entré au journal en 1974, il occupa le poste de chroniqueur religieux jusqu’en 1985 avant de rejoindre le service communication. Auteur de nombreux ouvrages, il est mort le 10 septembre, à l’âge de 82 ans.","{'type': 'text/html', 'language': None, 'base': 'http://web.archive.org/web/20201004215429/https://www.lemonde.fr/disparitions/rss_full.xml', 'value': 'Entré au journal en\xa01974, il occupa le poste de chroniqueur religieux jusqu’en\xa01985 avant de rejoindre le service communication. Auteur de nombreux ouvrages, il est mort le 10\xa0septembre, à l’âge de 82\xa0ans.'}",https://www.lemonde.fr/disparitions/article/2020/09/20/la-mort-d-alain-woodrow-ancien-journaliste-au-monde_6052937_3382.html,True,https://www.lemonde.fr/disparitions/article/2020/09/20/la-mort-d-alain-woodrow-ancien-journaliste-au-monde_6052937_3382.html,"[{'rel': 'alternate', 'type': 'text/html', 'href': 'https://www.lemonde.fr/disparitions/article/2020/09/20/la-mort-d-alain-woodrow-ancien-journaliste-au-monde_6052937_3382.html'}]","[{'url': 'https://img.lemde.fr/2020/09/18/1361/0/2417/1208/644/322/60/0/a82beab_100577346-opaleplus-opale11859-02.jpg', 'width': '644', 'height': '322'}]","[{'type': 'text/plain', 'language': None, 'base': 'http://web.archive.org/web/20201004215429/https://www.lemonde.fr/disparitions/rss_full.xml', 'value': 'Alain Woodrow, en 2001.'}]","[{'scheme': 'urn:ebu', 'content': 'Philippe Matsas/Opale/Leemage'}]",Philippe Matsas/Opale/Leemage
"Marcel Trillat, journaliste et documentariste, est mort","{'type': 'text/plain', 'language': None, 'base': 'http://web.archive.org/web/20201004215429/https://www.lemonde.fr/disparitions/rss_full.xml', 'value': 'Marcel Trillat, journaliste et\xa0documentariste, est mort'}","Sat, 19 Sep 2020 14:11:36 +0200","time.struct_time(tm_year=2020, tm_mon=9, tm_mday=19, tm_hour=12, tm_min=11, tm_sec=36, tm_wday=5, tm_yday=263, tm_isdst=0)","Entré dans l’équipe de « Cinq colonnes à la “une” » en 1965, il réalisa de nombreux reportages sur les lieux des luttes sociales. Il est mort le 18 septembre, à l’âge de 80 ans.","{'type': 'text/html', 'language': None, 'base': 'http://web.archive.org/web/20201004215429/https://www.lemonde.fr/disparitions/rss_full.xml', 'value': 'Entré dans l’équipe de «\xa0Cinq colonnes à la “une”\xa0» en\xa01965, il réalisa de nombreux reportages sur les lieux des luttes sociales. Il est mort le 18\xa0septembre, à l’âge de 80\xa0ans.'}",https://www.lemonde.fr/televisions-radio/article/2020/09/19/marcel-trillat-journaliste-et-documentariste-est-mort_6052867_1655027.html,True,https://www.lemonde.fr/televisions-radio/article/2020/09/19/marcel-trillat-journaliste-et-documentariste-est-mort_6052867_1655027.html,"[{'rel': 'alternate', 'type': 'text/html', 'href': 'https://www.lemonde.fr/televisions-radio/article/2020/09/19/marcel-trillat-journaliste-et-documentariste-est-mort_6052867_1655027.html'}]","[{'url': 'https://img.lemde.fr/2020/09/19/1686/0/3413/1693/644/322/60/0/fec59f8_226400021-divergence-gba0503009.jpg', 'width': '644', 'height': '322'}]","[{'type': 'text/plain', 'language': None, 'base': 'http://web.archive.org/web/20201004215429/https://www.lemonde.fr/disparitions/rss_full.xml', 'value': 'Marcel Trillat, à la fête de l’Humanité, à la Courneuve (Seine-Saint-Denis), en septembre 2011.'}]","[{'scheme': 'urn:ebu', 'content': 'Georges Bartoli / Divergence'}]",Georges Bartoli / Divergence
