title,title_detail,published,published_parsed,summary,summary_detail,id,guidislink,link,links,media_content,content,media_credit,credit
"Simone Vilalta, résistante et déportée, est morte","{'type': 'text/plain', 'language': None, 'base': 'http://web.archive.org/web/20210126170438/https://www.lemonde.fr/disparitions/rss_full.xml', 'value': 'Simone Vilalta, résistante et déportée, est morte'}","Thu, 21 Jan 2021 11:57:07 +0100","time.struct_time(tm_year=2021, tm_mon=1, tm_mday=21, tm_hour=10, tm_min=57, tm_sec=7, tm_wday=3, tm_yday=21, tm_isdst=0)","Arrêtée en 1943 et transférée au camp de Ravensbrück, libérée en 1945, elle aura témoigné toute sa vie de l’enfer auprès des élèves des écoles. Elle est morte le 1er janvier, à l’âge de 97 ans.","{'type': 'text/html', 'language': None, 'base': 'http://web.archive.org/web/20210126170438/https://www.lemonde.fr/disparitions/rss_full.xml', 'value': 'Arrêtée en\xa01943 et transférée au camp de Ravensbrück, libérée en\xa01945, elle aura témoigné toute sa vie de l’enfer auprès des élèves des écoles. Elle est morte le 1er\xa0janvier, à l’âge de 97\xa0ans.'}",https://www.lemonde.fr/disparitions/article/2021/01/21/simone-vilalta-resistante-et-deportee-est-morte_6067077_3382.html,True,https://www.lemonde.fr/disparitions/article/2021/01/21/simone-vilalta-resistante-et-deportee-est-morte_6067077_3382.html,"[{'rel': 'alternate', 'type': 'text/html', 'href': 'https://www.lemonde.fr/disparitions/article/2021/01/21/simone-vilalta-resistante-et-deportee-est-morte_6067077_3382.html'}]","[{'url': 'https://img.lemde.fr/2021/01/21/88/0/1000/500/644/322/60/0/5eacb31_773246739-simone-vilalta-et-sa.jpg', 'width': '644', 'height': '322'}]","[{'type': 'text/plain', 'language': None, 'base': 'http://web.archive.org/web/20210126170438/https://www.lemonde.fr/disparitions/rss_full.xml', 'value': 'Simone Vilalta et sa tenue de détenue du camp de Ravensbrück (Allemagne).'}]","[{'scheme': 'urn:ebu', 'content': 'Archives O.D.'}]",Archives O.D.
"Jean-Louis Quermonne, professeur de sciences politiques, est mort","{'type': 'text/plain', 'language': None, 'base': 'http://web.archive.org/web/20210126170438/https://www.lemonde.fr/disparitions/rss_full.xml', 'value': 'Jean-Louis Quermonne, professeur de sciences politiques, est mort'}","Wed, 20 Jan 2021 15:33:51 +0100","time.struct_time(tm_year=2021, tm_mon=1, tm_mday=20, tm_hour=14, tm_min=33, tm_sec=51, tm_wday=2, tm_yday=20, tm_isdst=0)","Ancien directeur de Sciences Po Grenoble avant d’enseigner à Sciences Po Paris, il s’était investi dans l’enseignement et la recherche sur la construction européenne. Il est mort le 17 janvier, à l’âge de 93 ans.","{'type': 'text/html', 'language': None, 'base': 'http://web.archive.org/web/20210126170438/https://www.lemonde.fr/disparitions/rss_full.xml', 'value': 'Ancien directeur de Sciences Po Grenoble avant d’enseigner à Sciences Po Paris, il s’était investi dans l’enseignement et la recherche sur la construction européenne. Il est mort le 17\xa0janvier, à l’âge de 93\xa0ans.'}",https://www.lemonde.fr/disparitions/article/2021/01/20/jean-louis-quermonne-professeur-de-sciences-politiques-est-mort_6066961_3382.html,True,https://www.lemonde.fr/disparitions/article/2021/01/20/jean-louis-quermonne-professeur-de-sciences-politiques-est-mort_6066961_3382.html,"[{'rel': 'alternate', 'type': 'text/html', 'href': 'https://www.lemonde.fr/disparitions/article/2021/01/20/jean-louis-quermonne-professeur-de-sciences-politiques-est-mort_6066961_3382.html'}]","[{'url': 'https://img.lemde.fr/2021/01/20/0/0/1460/730/644/322/60/0/d099b93_907916551-quermonne-jean-louis-1960.jpg', 'width': '644', 'height': '322'}]","[{'type': 'text/plain', 'language': None, 'base': 'http://web.archive.org/web/20210126170438/https://www.lemonde.fr/disparitions/rss_full.xml', 'value': 'Jean-Louis Quermonne, dans les années 1960.'}]","[{'scheme': 'urn:ebu', 'content': 'Université de Grenoble Alpes'}]",Université de Grenoble Alpes
"Catherine Rich, second rôle au théâtre et à l’écran, est morte","{'type': 'text/plain', 'language': None, 'base': 'http://web.archive.org/web/20210126170438/https://www.lemonde.fr/disparitions/rss_full.xml', 'value': 'Catherine Rich, second rôle au théâtre et à l’écran, est morte'}","Tue, 19 Jan 2021 16:56:49 +0100","time.struct_time(tm_year=2021, tm_mon=1, tm_mday=19, tm_hour=15, tm_min=56, tm_sec=49, tm_wday=1, tm_yday=19, tm_isdst=0)","L’actrice a été remarquée au théâtre, mais aussi au cinéma et dans une dizaine de séries à succès sur le petit écran. Elle était mariée à Claude Rich, mort en 2017.","{'type': 'text/html', 'language': None, 'base': 'http://web.archive.org/web/20210126170438/https://www.lemonde.fr/disparitions/rss_full.xml', 'value': 'L’actrice a été remarquée au théâtre, mais aussi au cinéma et dans une dizaine de séries à succès sur le petit écran. Elle était mariée à Claude Rich, mort en\xa02017.'}",https://www.lemonde.fr/disparitions/article/2021/01/19/catherine-rich-second-role-au-theatre-et-a-l-ecran-est-morte_6066820_3382.html,True,https://www.lemonde.fr/disparitions/article/2021/01/19/catherine-rich-second-role-au-theatre-et-a-l-ecran-est-morte_6066820_3382.html,"[{'rel': 'alternate', 'type': 'text/html', 'href': 'https://www.lemonde.fr/disparitions/article/2021/01/19/catherine-rich-second-role-au-theatre-et-a-l-ecran-est-morte_6066820_3382.html'}]","[{'url': 'https://img.lemde.fr/2021/01/19/275/0/2048/1024/644/322/60/0/2805720_457572419-000-app2000092156282.jpg', 'width': '644', 'height': '322'}]",,"[{'scheme': 'urn:ebu', 'content': 'ANNE-CHRISTINE POUJOULAT / AFP'}]",ANNE-CHRISTINE POUJOULAT / AFP
"Patrick Williams, anthropologue du monde gitan, est mort","{'type': 'text/plain', 'language': None, 'base': 'http://web.archive.org/web/20210126170438/https://www.lemonde.fr/disparitions/rss_full.xml', 'value': 'Patrick Williams, anthropologue du monde gitan, est mort'}","Tue, 19 Jan 2021 16:32:26 +0100","time.struct_time(tm_year=2021, tm_mon=1, tm_mday=19, tm_hour=15, tm_min=32, tm_sec=26, tm_wday=1, tm_yday=19, tm_isdst=0)","Poète et penseur du jazz, il a consacré plusieurs ouvrages aux Manouches et au guitariste Django Reinhardt. Il est mort le 15 janvier, à l’âge de 73 ans.","{'type': 'text/html', 'language': None, 'base': 'http://web.archive.org/web/20210126170438/https://www.lemonde.fr/disparitions/rss_full.xml', 'value': 'Poète et penseur du jazz, il a consacré plusieurs ouvrages aux Manouches et au guitariste Django Reinhardt. Il est mort le 15\xa0janvier, à l’âge de 73\xa0ans.'}",https://www.lemonde.fr/disparitions/article/2021/01/19/patrick-williams-anthropologue-du-monde-gitan-est-mort_6066817_3382.html,True,https://www.lemonde.fr/disparitions/article/2021/01/19/patrick-williams-anthropologue-du-monde-gitan-est-mort_6066817_3382.html,"[{'rel': 'alternate', 'type': 'text/html', 'href': 'https://www.lemonde.fr/disparitions/article/2021/01/19/patrick-williams-anthropologue-du-monde-gitan-est-mort_6066817_3382.html'}]","[{'url': 'https://img.lemde.fr/2021/01/19/99/0/640/320/644/322/60/0/66e2de2_521797945-img-1779.jpeg', 'width': '644', 'height': '322'}]","[{'type': 'text/plain', 'language': None, 'base': 'http://web.archive.org/web/20210126170438/https://www.lemonde.fr/disparitions/rss_full.xml', 'value': 'Patrick Williams.'}]","[{'scheme': 'urn:ebu', 'content': 'ARCHIVE FAMILIALE'}]",ARCHIVE FAMILIALE
"Jean-Pierre Bacri, la mort d’un râleur lumineux","{'type': 'text/plain', 'language': None, 'base': 'http://web.archive.org/web/20210126170438/https://www.lemonde.fr/disparitions/rss_full.xml', 'value': 'Jean-Pierre Bacri, la mort d’un râleur lumineux'}","Tue, 19 Jan 2021 06:25:48 +0100","time.struct_time(tm_year=2021, tm_mon=1, tm_mday=19, tm_hour=5, tm_min=25, tm_sec=48, tm_wday=1, tm_yday=19, tm_isdst=0)","Auteur, comédien au cinéma et au théâtre, il a créé, notamment avec son double Agnès Jaoui, des comédies grinçantes mais toujours marquées du sceau du respect pour leurs personnages. Il a succombé à un cancer à 69 ans.","{'type': 'text/html', 'language': None, 'base': 'http://web.archive.org/web/20210126170438/https://www.lemonde.fr/disparitions/rss_full.xml', 'value': 'Auteur, comédien au cinéma et au théâtre, il a créé, notamment avec son double Agnès Jaoui, des comédies grinçantes mais toujours marquées du sceau du respect pour leurs personnages. Il a succombé à un cancer à 69 ans.'}",https://www.lemonde.fr/disparitions/article/2021/01/19/droopy-eruptif-du-theatre-et-du-cinema-francais-jean-pierre-bacri-est-mort-a-l-age-de-69-ans_6066749_3382.html,True,https://www.lemonde.fr/disparitions/article/2021/01/19/droopy-eruptif-du-theatre-et-du-cinema-francais-jean-pierre-bacri-est-mort-a-l-age-de-69-ans_6066749_3382.html,"[{'rel': 'alternate', 'type': 'text/html', 'href': 'https://www.lemonde.fr/disparitions/article/2021/01/19/droopy-eruptif-du-theatre-et-du-cinema-francais-jean-pierre-bacri-est-mort-a-l-age-de-69-ans_6066749_3382.html'}]","[{'url': 'https://img.lemde.fr/2021/01/19/374/0/3543/1766/644/322/60/0/37e5a62_801970584-gettyimages-627632634.jpg', 'width': '644', 'height': '322'}]","[{'type': 'text/plain', 'language': None, 'base': 'http://web.archive.org/web/20210126170438/https://www.lemonde.fr/disparitions/rss_full.xml', 'value': 'Jean-Pierre Bacri, en 2003.'}]","[{'scheme': 'urn:ebu', 'content': 'PASCALITO/CORBIS/GETTY'}]",PASCALITO/CORBIS/GETTY
Jean-Pierre Bacri en 10 répliques,"{'type': 'text/plain', 'language': None, 'base': 'http://web.archive.org/web/20210126170438/https://www.lemonde.fr/disparitions/rss_full.xml', 'value': 'Jean-Pierre Bacri en 10\xa0répliques'}","Mon, 18 Jan 2021 19:06:34 +0100","time.struct_time(tm_year=2021, tm_mon=1, tm_mday=18, tm_hour=18, tm_min=6, tm_sec=34, tm_wday=0, tm_yday=18, tm_isdst=0)","L’acteur, scénariste et dramaturge est mort, lundi 18 janvier. Retour sur sa carrière en quelques répliques cultes.","{'type': 'text/html', 'language': None, 'base': 'http://web.archive.org/web/20210126170438/https://www.lemonde.fr/disparitions/rss_full.xml', 'value': 'L’acteur, scénariste et dramaturge est mort, lundi 18\xa0janvier. Retour sur sa carrière en quelques répliques cultes.'}",https://www.lemonde.fr/disparitions/video/2021/01/18/jean-pierre-bacri-en-10-repliques_6066706_3382.html,True,https://www.lemonde.fr/disparitions/video/2021/01/18/jean-pierre-bacri-en-10-repliques_6066706_3382.html,"[{'rel': 'alternate', 'type': 'text/html', 'href': 'https://www.lemonde.fr/disparitions/video/2021/01/18/jean-pierre-bacri-en-10-repliques_6066706_3382.html'}]","[{'url': 'https://img.lemde.fr/2021/01/18/551/294/2330/1165/644/322/60/0/380c8e4_28467664-qup0015973.jpg', 'width': '644', 'height': '322'}]",,"[{'scheme': 'urn:ebu', 'content': 'PHILIPPE QAISSE / PASCO'}]",PHILIPPE QAISSE / PASCO
"Jean-Pierre Bacri, en 2011 : « Ma gueule fait la gueule, c’est ainsi »","{'type': 'text/plain', 'language': None, 'base': 'http://web.archive.org/web/20210126170438/https://www.lemonde.fr/disparitions/rss_full.xml', 'value': 'Jean-Pierre Bacri, en 2011\xa0: «\xa0Ma gueule fait la gueule, c’est ainsi\xa0»'}","Mon, 18 Jan 2021 17:57:08 +0100","time.struct_time(tm_year=2021, tm_mon=1, tm_mday=18, tm_hour=16, tm_min=57, tm_sec=8, tm_wday=0, tm_yday=18, tm_isdst=0)","Il y a dix ans, « Le Monde magazine » avait consacré un « Je ne serais pas là si » à Jean-Pierre Bacri, dont on a appris la mort lundi 18 janvier 2021. Quand Bacri, le taciturne, se racontait et disait tout ce qu’il devait aussi à Agnès Jaoui.","{'type': 'text/html', 'language': None, 'base': 'http://web.archive.org/web/20210126170438/https://www.lemonde.fr/disparitions/rss_full.xml', 'value': 'Il y a dix ans, «\xa0Le Monde magazine\xa0» avait consacré un «\xa0Je ne serais pas là si\xa0» à Jean-Pierre Bacri, dont on a appris la mort lundi 18 janvier 2021. Quand Bacri, le taciturne, se racontait et disait tout ce qu’il devait aussi à Agnès Jaoui.'}",https://www.lemonde.fr/cinema/article/2021/01/18/jean-pierre-bacri-en-2011-ma-gueule-fait-la-gueule-c-est-ainsi_6066691_3476.html,True,https://www.lemonde.fr/cinema/article/2021/01/18/jean-pierre-bacri-en-2011-ma-gueule-fait-la-gueule-c-est-ainsi_6066691_3476.html,"[{'rel': 'alternate', 'type': 'text/html', 'href': 'https://www.lemonde.fr/cinema/article/2021/01/18/jean-pierre-bacri-en-2011-ma-gueule-fait-la-gueule-c-est-ainsi_6066691_3476.html'}]","[{'url': 'https://img.lemde.fr/2021/01/18/517/0/1693/843/644/322/60/0/267903e_924653321-364892.jpg', 'width': '644', 'height': '322'}]","[{'type': 'text/plain', 'language': None, 'base': 'http://web.archive.org/web/20210126170438/https://www.lemonde.fr/disparitions/rss_full.xml', 'value': 'En 2005,\xa0 au théâtre des Amandiers, à Nanterre.'}]","[{'scheme': 'urn:ebu', 'content': 'BERTRAND GUAY / AFP'}]",BERTRAND GUAY / AFP
