title,title_detail,published,published_parsed,summary,summary_detail,id,guidislink,link,links,media_content,content,media_credit,credit
"La romancière Anne Rice, autrice des « Chroniques des vampires », est morte","{'type': 'text/plain', 'language': None, 'base': 'http://web.archive.org/web/20211218233554/https://www.lemonde.fr/disparitions/rss_full.xml', 'value': 'La romancière Anne Rice, autrice des «\xa0Chroniques des vampires\xa0», est morte'}","Sun, 12 Dec 2021 10:38:48 +0100","time.struct_time(tm_year=2021, tm_mon=12, tm_mday=12, tm_hour=9, tm_min=38, tm_sec=48, tm_wday=6, tm_yday=346, tm_isdst=0)","Ecrivaine aux plus de 100 millions de livres vendus, elle a consacré son œuvre à refaçonner la figure mythologique du vampire, devenu sous sa plume un être sensuel, tourmenté et érotique. Elle est morte le 11 décembre, à l’âge de 80 ans","{'type': 'text/html', 'language': None, 'base': 'http://web.archive.org/web/20211218233554/https://www.lemonde.fr/disparitions/rss_full.xml', 'value': 'Ecrivaine aux plus de 100\xa0millions de livres vendus, elle a consacré son œuvre à refaçonner la figure mythologique du vampire, devenu sous sa plume un être sensuel, tourmenté et érotique. Elle est morte le\xa011\xa0décembre, à l’âge de\xa080\xa0ans'}",https://www.lemonde.fr/disparitions/article/2021/12/12/la-romanciere-anne-rice-autrice-des-chroniques-des-vampires-est-morte_6105749_3382.html,True,https://www.lemonde.fr/disparitions/article/2021/12/12/la-romanciere-anne-rice-autrice-des-chroniques-des-vampires-est-morte_6105749_3382.html,"[{'rel': 'alternate', 'type': 'text/html', 'href': 'https://www.lemonde.fr/disparitions/article/2021/12/12/la-romanciere-anne-rice-autrice-des-chroniques-des-vampires-est-morte_6105749_3382.html'}]","[{'url': 'https://img.lemde.fr/2021/12/14/600/0/2400/1200/644/322/60/0/e1b44e7_91174562-5d8b4e1-837209788-bestimage-00551684-000001.jpg', 'width': '644', 'height': '322'}]","[{'type': 'text/plain', 'language': None, 'base': 'http://web.archive.org/web/20211218233554/https://www.lemonde.fr/disparitions/rss_full.xml', 'value': 'Anne Rice à son domicile à La Jolia (États-Unis), le 26 octobre 2005.'}]","[{'scheme': 'urn:ebu', 'content': 'Zuma Press / Bestimage'}]",Zuma Press / Bestimage
"Mort de Maryse Wolinski, romancière et journaliste libre et engagée","{'type': 'text/plain', 'language': None, 'base': 'http://web.archive.org/web/20211218233554/https://www.lemonde.fr/disparitions/rss_full.xml', 'value': 'Mort de Maryse Wolinski, romancière et journaliste libre et engagée'}","Sat, 11 Dec 2021 20:14:02 +0100","time.struct_time(tm_year=2021, tm_mon=12, tm_mday=11, tm_hour=19, tm_min=14, tm_sec=2, tm_wday=5, tm_yday=345, tm_isdst=0)","Rédactrice pour plusieurs titres de presse, autrice à succès, elle avait rédigé, en 2016, un récit poignant de l’attentat contre « Charlie Hebdo », où son mari, Georges, avait trouvé la mort.","{'type': 'text/html', 'language': None, 'base': 'http://web.archive.org/web/20211218233554/https://www.lemonde.fr/disparitions/rss_full.xml', 'value': 'Rédactrice pour plusieurs titres de presse, autrice à succès, elle avait rédigé, en\xa02016, un récit poignant de l’attentat contre «\xa0Charlie Hebdo\xa0», où son mari, Georges, avait trouvé la mort.'}",https://www.lemonde.fr/disparitions/article/2021/12/11/maryse-wolinski-romanciere-et-journaliste-libre-et-engagee-est-morte_6105715_3382.html,True,https://www.lemonde.fr/disparitions/article/2021/12/11/maryse-wolinski-romanciere-et-journaliste-libre-et-engagee-est-morte_6105715_3382.html,"[{'rel': 'alternate', 'type': 'text/html', 'href': 'https://www.lemonde.fr/disparitions/article/2021/12/11/maryse-wolinski-romanciere-et-journaliste-libre-et-engagee-est-morte_6105715_3382.html'}]","[{'url': 'https://img.lemde.fr/2021/12/09/424/0/3408/1704/644/322/60/0/865fe65_5166940-01-06.jpg', 'width': '644', 'height': '322'}]","[{'type': 'text/plain', 'language': None, 'base': 'http://web.archive.org/web/20211218233554/https://www.lemonde.fr/disparitions/rss_full.xml', 'value': 'Maryse Wolinski, le 13\xa0juin 2015.'}]","[{'scheme': 'urn:ebu', 'content': 'REMY GABALDA / AFP'}]",REMY GABALDA / AFP
"Jacques Auxiette, ancien président des Pays de la Loire, est mort","{'type': 'text/plain', 'language': None, 'base': 'http://web.archive.org/web/20211218233554/https://www.lemonde.fr/disparitions/rss_full.xml', 'value': 'Jacques Auxiette, ancien président des Pays de la Loire, est mort'}","Sat, 11 Dec 2021 16:11:53 +0100","time.struct_time(tm_year=2021, tm_mon=12, tm_mday=11, tm_hour=15, tm_min=11, tm_sec=53, tm_wday=5, tm_yday=345, tm_isdst=0)","L’annonce de la mort de l’élu socialiste a suscité des réactions unanimes, saluant son engagement et sa passion du travail de terrain.","{'type': 'text/html', 'language': None, 'base': 'http://web.archive.org/web/20211218233554/https://www.lemonde.fr/disparitions/rss_full.xml', 'value': 'L’annonce de la mort de l’élu socialiste a suscité des réactions unanimes, saluant son engagement et sa passion du travail de terrain.'}",https://www.lemonde.fr/disparitions/article/2021/12/11/jacques-auxiette-ancien-president-des-pays-de-la-loire-est-mort_6105702_3382.html,True,https://www.lemonde.fr/disparitions/article/2021/12/11/jacques-auxiette-ancien-president-des-pays-de-la-loire-est-mort_6105702_3382.html,"[{'rel': 'alternate', 'type': 'text/html', 'href': 'https://www.lemonde.fr/disparitions/article/2021/12/11/jacques-auxiette-ancien-president-des-pays-de-la-loire-est-mort_6105702_3382.html'}]","[{'url': 'https://img.lemde.fr/2021/12/11/0/0/4256/2124/644/322/60/0/01d90f7_881449726-000-par8044251.jpg', 'width': '644', 'height': '322'}]","[{'type': 'text/plain', 'language': None, 'base': 'http://web.archive.org/web/20211218233554/https://www.lemonde.fr/disparitions/rss_full.xml', 'value': 'Jacques Auxiette, président de la région Pays de la Loire, à Nantes, le 1er\xa0décembre 2014.'}]","[{'scheme': 'urn:ebu', 'content': 'JEAN-SEBASTIEN EVRARD / AFP'}]",JEAN-SEBASTIEN EVRARD / AFP
"Mort d’Edouard Crépey, adjoint au secrétariat général du gouvernement","{'type': 'text/plain', 'language': None, 'base': 'http://web.archive.org/web/20211218233554/https://www.lemonde.fr/disparitions/rss_full.xml', 'value': 'Mort d’Edouard Crépey, adjoint au secrétariat général du gouvernement'}","Sat, 11 Dec 2021 10:33:22 +0100","time.struct_time(tm_year=2021, tm_mon=12, tm_mday=11, tm_hour=9, tm_min=33, tm_sec=22, tm_wday=5, tm_yday=345, tm_isdst=0)","Haut fonctionnaire, conseiller d’Etat, il avait travaillé au cabinet de Nicolas Sarkozy à l’Elysée, notamment sur la réforme constitutionnelle de 2008. Il avait rejoint le secrétariat général du gouvernement en 2019. Il est décédé le 28 novembre, à l’âge de 45 ans.","{'type': 'text/html', 'language': None, 'base': 'http://web.archive.org/web/20211218233554/https://www.lemonde.fr/disparitions/rss_full.xml', 'value': 'Haut fonctionnaire, conseiller d’Etat, il avait travaillé au cabinet de Nicolas Sarkozy à l’Elysée, notamment sur la réforme constitutionnelle de 2008. Il avait rejoint le secrétariat général du gouvernement en\xa02019. Il est décédé le 28\xa0novembre, à l’âge de 45\xa0ans.'}",https://www.lemonde.fr/politique/article/2021/12/11/mort-d-edouard-crepey-adjoint-au-secretariat-general-du-gouvernement_6105672_823448.html,True,https://www.lemonde.fr/politique/article/2021/12/11/mort-d-edouard-crepey-adjoint-au-secretariat-general-du-gouvernement_6105672_823448.html,"[{'rel': 'alternate', 'type': 'text/html', 'href': 'https://www.lemonde.fr/politique/article/2021/12/11/mort-d-edouard-crepey-adjoint-au-secretariat-general-du-gouvernement_6105672_823448.html'}]","[{'url': 'https://img.lemde.fr/2021/12/10/1208/0/2796/1398/644/322/60/0/4e3331d_568826298-maxnewsworldtwo168317.jpeg', 'width': '644', 'height': '322'}]","[{'type': 'text/plain', 'language': None, 'base': 'http://web.archive.org/web/20211218233554/https://www.lemonde.fr/disparitions/rss_full.xml', 'value': 'Edouard Crépey, à\xa0Paris, le 19 janvier 2012.'}]","[{'scheme': 'urn:ebu', 'content': 'GUILLAUME CLEMENT / MAXPPP'}]",GUILLAUME CLEMENT / MAXPPP
"Mort de Michael Nesmith, membre des Monkees, groupe de rock américain à succès des années 1960","{'type': 'text/plain', 'language': None, 'base': 'http://web.archive.org/web/20211218233554/https://www.lemonde.fr/disparitions/rss_full.xml', 'value': 'Mort de Michael Nesmith, membre des Monkees, groupe de rock américain à succès des années\xa01960'}","Sat, 11 Dec 2021 04:36:32 +0100","time.struct_time(tm_year=2021, tm_mon=12, tm_mday=11, tm_hour=3, tm_min=36, tm_sec=32, tm_wday=5, tm_yday=345, tm_isdst=0)","Le groupe californien est considéré comme le premier boys band de l’histoire, monté de toutes pièces pour une émission de télévision, en pleine Beatlemania.","{'type': 'text/html', 'language': None, 'base': 'http://web.archive.org/web/20211218233554/https://www.lemonde.fr/disparitions/rss_full.xml', 'value': 'Le groupe californien est considéré comme le premier boys band de l’histoire, monté de toutes pièces pour une émission de télévision, en pleine Beatlemania.'}",https://www.lemonde.fr/disparitions/article/2021/12/11/mort-de-michael-nesmith-membre-des-monkees-groupe-de-rock-americain-a-succes-des-annees-1960_6105622_3382.html,True,https://www.lemonde.fr/disparitions/article/2021/12/11/mort-de-michael-nesmith-membre-des-monkees-groupe-de-rock-americain-a-succes-des-annees-1960_6105622_3382.html,"[{'rel': 'alternate', 'type': 'text/html', 'href': 'https://www.lemonde.fr/disparitions/article/2021/12/11/mort-de-michael-nesmith-membre-des-monkees-groupe-de-rock-americain-a-succes-des-annees-1960_6105622_3382.html'}]","[{'url': 'https://img.lemde.fr/2021/12/10/121/0/5372/2686/644/322/60/0/5e5e761_809065542fe54ee3a91bd7762fc0f926-809065542fe54ee3a91bd7762fc0f926-0.jpg', 'width': '644', 'height': '322'}]","[{'type': 'text/plain', 'language': None, 'base': 'http://web.archive.org/web/20211218233554/https://www.lemonde.fr/disparitions/rss_full.xml', 'value': 'Michael Nesmith, le 5\xa0novembre\xa02021, à Rosemont (Illinois).'}]","[{'scheme': 'urn:ebu', 'content': 'Rob Grabowski / Rob Grabowski/Invision/AP'}]",Rob Grabowski / Rob Grabowski/Invision/AP
Le collectionneur belge Anton Herbert est mort,"{'type': 'text/plain', 'language': None, 'base': 'http://web.archive.org/web/20211218233554/https://www.lemonde.fr/disparitions/rss_full.xml', 'value': 'Le collectionneur belge Anton Herbert est mort'}","Fri, 10 Dec 2021 19:25:47 +0100","time.struct_time(tm_year=2021, tm_mon=12, tm_mday=10, tm_hour=18, tm_min=25, tm_sec=47, tm_wday=4, tm_yday=344, tm_isdst=0)","Avec son épouse, il avait bâti une exceptionnelle collection d’art conceptuel et minimal réunie, depuis 2013, dans une fondation basée à Gand. Il est décédé le 7 décembre, à l’âge de 83 ans.","{'type': 'text/html', 'language': None, 'base': 'http://web.archive.org/web/20211218233554/https://www.lemonde.fr/disparitions/rss_full.xml', 'value': 'Avec son épouse, il avait bâti une exceptionnelle collection d’art conceptuel et minimal réunie, depuis 2013, dans une fondation basée à Gand. Il est décédé le 7\xa0décembre, à l’âge de 83\xa0ans.'}",https://www.lemonde.fr/disparitions/article/2021/12/10/le-collectionneur-belge-anton-herbert-est-mort_6105599_3382.html,True,https://www.lemonde.fr/disparitions/article/2021/12/10/le-collectionneur-belge-anton-herbert-est-mort_6105599_3382.html,"[{'rel': 'alternate', 'type': 'text/html', 'href': 'https://www.lemonde.fr/disparitions/article/2021/12/10/le-collectionneur-belge-anton-herbert-est-mort_6105599_3382.html'}]","[{'url': 'https://img.lemde.fr/2021/12/10/446/0/6016/3000/644/322/60/0/05dc3d2_418721541-2015-yuri-van-der-hoeven.jpg', 'width': '644', 'height': '322'}]","[{'type': 'text/plain', 'language': None, 'base': 'http://web.archive.org/web/20211218233554/https://www.lemonde.fr/disparitions/rss_full.xml', 'value': 'Les collectionneurs Anton et Annick Herbert, à la Fondation Herbert, en 2015.'}]","[{'scheme': 'urn:ebu', 'content': 'YURI VAN DER HOEVEN'}]",YURI VAN DER HOEVEN
"Gérard Grandval, l’architecte des immeubles-choux de Créteil, est mort","{'type': 'text/plain', 'language': None, 'base': 'http://web.archive.org/web/20211218233554/https://www.lemonde.fr/disparitions/rss_full.xml', 'value': 'Gérard Grandval, l’architecte des immeubles-choux de Créteil, est mort'}","Fri, 10 Dec 2021 19:24:18 +0100","time.struct_time(tm_year=2021, tm_mon=12, tm_mday=10, tm_hour=18, tm_min=24, tm_sec=18, tm_wday=4, tm_yday=344, tm_isdst=0)","Inscrit au patrimoine du XXe siècle, cet ensemble de logements aux balcons en forme de pétales de fleurs a marqué l’identité de la préfecture du Val-de-Marne. Son concepteur, lauréat du prix de Rome en 1961, s’est éteint jeudi 2 décembre, à l’âge de 91 ans.","{'type': 'text/html', 'language': None, 'base': 'http://web.archive.org/web/20211218233554/https://www.lemonde.fr/disparitions/rss_full.xml', 'value': 'Inscrit au patrimoine du XXe\xa0siècle, cet ensemble de logements aux balcons en forme de pétales de fleurs a marqué l’identité de la préfecture du Val-de-Marne. Son concepteur, lauréat du prix de Rome en\xa01961, s’est éteint jeudi 2\xa0décembre, à l’âge de 91\xa0ans.'}",https://www.lemonde.fr/disparitions/article/2021/12/10/gerard-grandval-l-architecte-des-immeubles-choux-de-creteil-est-mort_6105597_3382.html,True,https://www.lemonde.fr/disparitions/article/2021/12/10/gerard-grandval-l-architecte-des-immeubles-choux-de-creteil-est-mort_6105597_3382.html,"[{'rel': 'alternate', 'type': 'text/html', 'href': 'https://www.lemonde.fr/disparitions/article/2021/12/10/gerard-grandval-l-architecte-des-immeubles-choux-de-creteil-est-mort_6105597_3382.html'}]","[{'url': 'https://img.lemde.fr/2021/12/10/131/2/2045/1022/644/322/60/0/351f7d8_476395167-4102736879-0947f9e022-k.jpg', 'width': '644', 'height': '322'}]","[{'type': 'text/plain', 'language': None, 'base': 'http://web.archive.org/web/20211218233554/https://www.lemonde.fr/disparitions/rss_full.xml', 'value': 'Les immeubles-choux (1969-1974) conçus par l’architecte Gérard Grandval, à Créteil (Val-de-Marne).'}]","[{'scheme': 'urn:ebu', 'content': 'FEDERICO NOVARO'}]",FEDERICO NOVARO
Mort du bassiste de reggae Robbie Shakespeare,"{'type': 'text/plain', 'language': None, 'base': 'http://web.archive.org/web/20211218233554/https://www.lemonde.fr/disparitions/rss_full.xml', 'value': 'Mort du bassiste de reggae Robbie Shakespeare'}","Fri, 10 Dec 2021 16:31:43 +0100","time.struct_time(tm_year=2021, tm_mon=12, tm_mday=10, tm_hour=15, tm_min=31, tm_sec=43, tm_wday=4, tm_yday=344, tm_isdst=0)",Le « rude boy » jamaïquain forma avec son complice batteur Sly Dunbar une des plus célèbres sections rythmiques des années 1980.,"{'type': 'text/html', 'language': None, 'base': 'http://web.archive.org/web/20211218233554/https://www.lemonde.fr/disparitions/rss_full.xml', 'value': 'Le «\xa0rude boy\xa0» jamaïquain forma avec son complice batteur Sly Dunbar une des plus célèbres sections rythmiques des années 1980.'}",https://www.lemonde.fr/culture/article/2021/12/10/mort-du-bassiste-de-reggae-robbie-shakespeare_6105565_3246.html,True,https://www.lemonde.fr/culture/article/2021/12/10/mort-du-bassiste-de-reggae-robbie-shakespeare_6105565_3246.html,"[{'rel': 'alternate', 'type': 'text/html', 'href': 'https://www.lemonde.fr/culture/article/2021/12/10/mort-du-bassiste-de-reggae-robbie-shakespeare_6105565_3246.html'}]","[{'url': 'https://img.lemde.fr/2021/12/10/281/0/3379/1689/644/322/60/0/1d5673d_243680552-000-par2665478-1.jpg', 'width': '644', 'height': '322'}]","[{'type': 'text/plain', 'language': None, 'base': 'http://web.archive.org/web/20211218233554/https://www.lemonde.fr/disparitions/rss_full.xml', 'value': 'Le bassiste Robert Shakespeare lors d’un concert au Montreux Jazz Festival en Suisse, le 12 juillet 2009.'}]","[{'scheme': 'urn:ebu', 'content': 'FABRICE COFFRINI / AFP'}]",FABRICE COFFRINI / AFP
