title,title_detail,published,published_parsed,summary,summary_detail,id,guidislink,link,links,media_content,content,media_credit,credit
"La mort de Thomas Bishop, professeur de littérature à l’université de New York","{'type': 'text/plain', 'language': None, 'base': 'http://web.archive.org/web/20220112005228/https://www.lemonde.fr/disparitions/rss_full.xml', 'value': 'La mort de Thomas Bishop, professeur de littérature à l’université de New York'}","Wed, 05 Jan 2022 16:20:38 +0100","time.struct_time(tm_year=2022, tm_mon=1, tm_mday=5, tm_hour=15, tm_min=20, tm_sec=38, tm_wday=2, tm_yday=5, tm_isdst=0)","Infatigable passeur littéraire entre les deux rives de l’Atlantique, il a dirigé la Maison française de l’université américaine, devenue sous sa houlette l’un des plus brillants foyers de la culture française aux Etats-Unis. Grande figure du monde intellectuel, il est décédé le 2 janvier, à l’âge 92 ans.","{'type': 'text/html', 'language': None, 'base': 'http://web.archive.org/web/20220112005228/https://www.lemonde.fr/disparitions/rss_full.xml', 'value': 'Infatigable passeur littéraire entre les deux rives de l’Atlantique, il a dirigé la Maison française de l’université américaine, devenue sous sa houlette l’un des plus brillants foyers de la culture française aux Etats-Unis. Grande figure du monde intellectuel, il est décédé le 2\xa0janvier, à l’âge 92\xa0ans.'}",https://www.lemonde.fr/disparitions/article/2022/01/05/la-mort-de-thomas-bishop-professeur-de-litterature-a-l-universite-de-new-york_6108306_3382.html,True,https://www.lemonde.fr/disparitions/article/2022/01/05/la-mort-de-thomas-bishop-professeur-de-litterature-a-l-universite-de-new-york_6108306_3382.html,"[{'rel': 'alternate', 'type': 'text/html', 'href': 'https://www.lemonde.fr/disparitions/article/2022/01/05/la-mort-de-thomas-bishop-professeur-de-litterature-a-l-universite-de-new-york_6108306_3382.html'}]","[{'url': 'https://img.lemde.fr/2022/01/05/570/0/2700/1350/644/322/60/0/712c865_634184459-tombishople-giond-honneur.jpg', 'width': '644', 'height': '322'}]","[{'type': 'text/plain', 'language': None, 'base': 'http://web.archive.org/web/20220112005228/https://www.lemonde.fr/disparitions/rss_full.xml', 'value': 'Thomas Bishop, en 2012.'}]","[{'scheme': 'urn:ebu', 'content': ""Beowulf Sheehan / Courtesy of NYU's Department of French Literature, Thought and Culture""}]","Beowulf Sheehan / Courtesy of NYU's Department of French Literature, Thought and Culture"
"La mort du paléontologue kényan Richard Leakey, « plus grand découvreur de fossiles de tous les temps »","{'type': 'text/plain', 'language': None, 'base': 'http://web.archive.org/web/20220112005228/https://www.lemonde.fr/disparitions/rss_full.xml', 'value': 'La mort du paléontologue kényan Richard Leakey, «\xa0plus grand découvreur de fossiles de tous les temps\xa0»'}","Tue, 04 Jan 2022 20:54:52 +0100","time.struct_time(tm_year=2022, tm_mon=1, tm_mday=4, tm_hour=19, tm_min=54, tm_sec=52, tm_wday=1, tm_yday=4, tm_isdst=0)","Découvreur de nombreux fossiles, ardent combattant du braconnage des pachydermes, il rêvait d’un musée de l’humanité dans la vallée du Rift. Il est décédé le 2 janvier, à l’âge de 77 ans.","{'type': 'text/html', 'language': None, 'base': 'http://web.archive.org/web/20220112005228/https://www.lemonde.fr/disparitions/rss_full.xml', 'value': 'Découvreur de nombreux fossiles, ardent combattant du braconnage des pachydermes, il rêvait d’un musée de l’humanité dans la vallée du Rift. Il est décédé le 2\xa0janvier, à l’âge de 77\xa0ans.'}",https://www.lemonde.fr/disparitions/article/2022/01/04/la-mort-du-paleontologue-kenyan-richard-leakey-plus-grand-decouvreur-de-fossiles-de-tous-les-temps_6108203_3382.html,True,https://www.lemonde.fr/disparitions/article/2022/01/04/la-mort-du-paleontologue-kenyan-richard-leakey-plus-grand-decouvreur-de-fossiles-de-tous-les-temps_6108203_3382.html,"[{'rel': 'alternate', 'type': 'text/html', 'href': 'https://www.lemonde.fr/disparitions/article/2022/01/04/la-mort-du-paleontologue-kenyan-richard-leakey-plus-grand-decouvreur-de-fossiles-de-tous-les-temps_6108203_3382.html'}]","[{'url': 'https://img.lemde.fr/2022/01/04/390/0/9000/4500/644/322/60/0/8a8eaa6_746120569-000-16q4pt.jpg', 'width': '644', 'height': '322'}]","[{'type': 'text/plain', 'language': None, 'base': 'http://web.archive.org/web/20220112005228/https://www.lemonde.fr/disparitions/rss_full.xml', 'value': 'Richard Leakey à Nairobi, au Kenya, le 27 juin 2018.'}]","[{'scheme': 'urn:ebu', 'content': 'YASUYOSHI CHIBA / AFP'}]",YASUYOSHI CHIBA / AFP
Igor Bogdanoff emporté à son tour par le Covid-19,"{'type': 'text/plain', 'language': None, 'base': 'http://web.archive.org/web/20220112005228/https://www.lemonde.fr/disparitions/rss_full.xml', 'value': 'Igor Bogdanoff emporté à son tour par le Covid-19'}","Tue, 04 Jan 2022 01:00:07 +0100","time.struct_time(tm_year=2022, tm_mon=1, tm_mday=4, tm_hour=0, tm_min=0, tm_sec=7, tm_wday=1, tm_yday=4, tm_isdst=0)","Six jours après son frère jumeau Grichka, l’homme de télévision, essayiste et docteur en physique, est mort à l’âge de 72 ans.","{'type': 'text/html', 'language': None, 'base': 'http://web.archive.org/web/20220112005228/https://www.lemonde.fr/disparitions/rss_full.xml', 'value': 'Six jours après son frère jumeau Grichka, l’homme de télévision, essayiste et docteur en physique, est mort à l’âge de 72\xa0ans.'}",https://www.lemonde.fr/disparitions/article/2022/01/04/igor-bogdanoff-emporte-a-son-tour-par-le-covid-19_6108079_3382.html,True,https://www.lemonde.fr/disparitions/article/2022/01/04/igor-bogdanoff-emporte-a-son-tour-par-le-covid-19_6108079_3382.html,"[{'rel': 'alternate', 'type': 'text/html', 'href': 'https://www.lemonde.fr/disparitions/article/2022/01/04/igor-bogdanoff-emporte-a-son-tour-par-le-covid-19_6108079_3382.html'}]","[{'url': 'https://img.lemde.fr/2021/12/28/221/0/5184/2592/644/322/60/0/a01f177_5251691-01-06.jpg', 'width': '644', 'height': '322'}]","[{'type': 'text/plain', 'language': None, 'base': 'http://web.archive.org/web/20220112005228/https://www.lemonde.fr/disparitions/rss_full.xml', 'value': 'Igor Bogdanoff (à gauche) à côté de son frère Grichka (à droite), à Paris, en mai 2013.'}]","[{'scheme': 'urn:ebu', 'content': 'VALERY HACHE / AFP'}]",VALERY HACHE / AFP
"Igor Bogdanoff est mort du Covid-19, six jours après son frère jumeau Grichka","{'type': 'text/plain', 'language': None, 'base': 'http://web.archive.org/web/20220112005228/https://www.lemonde.fr/disparitions/rss_full.xml', 'value': 'Igor Bogdanoff est mort du Covid-19, six jours après son frère jumeau Grichka'}","Mon, 03 Jan 2022 18:30:38 +0100","time.struct_time(tm_year=2022, tm_mon=1, tm_mday=3, tm_hour=17, tm_min=30, tm_sec=38, tm_wday=0, tm_yday=3, tm_isdst=0)","Son frère Grichka et lui formaient un duo emblématique, notamment connu pour avoir animé l’émission de science-fiction « Temps X », diffusée de 1979 à 1987 sur TF1. Agés de 72 ans, tous deux avaient été hospitalisés le 15 décembre à Paris après avoir contracté le Covid-19.","{'type': 'text/html', 'language': None, 'base': 'http://web.archive.org/web/20220112005228/https://www.lemonde.fr/disparitions/rss_full.xml', 'value': 'Son frère Grichka et lui formaient un duo emblématique, notamment connu pour avoir animé l’émission de science-fiction «\xa0Temps X\xa0», diffusée de 1979 à 1987 sur TF1. Agés de 72\xa0ans, tous deux avaient été hospitalisés le 15\xa0décembre à Paris après avoir contracté le Covid-19.'}",https://www.lemonde.fr/disparitions/article/2022/01/03/igor-bogdanoff-est-mort-six-jours-apres-son-frere-jumeau-grichka_6108061_3382.html,True,https://www.lemonde.fr/disparitions/article/2022/01/03/igor-bogdanoff-est-mort-six-jours-apres-son-frere-jumeau-grichka_6108061_3382.html,"[{'rel': 'alternate', 'type': 'text/html', 'href': 'https://www.lemonde.fr/disparitions/article/2022/01/03/igor-bogdanoff-est-mort-six-jours-apres-son-frere-jumeau-grichka_6108061_3382.html'}]","[{'url': 'https://img.lemde.fr/2022/01/03/408/0/4928/2464/644/322/60/0/cb7af03_774658542-000-19k7wu.jpg', 'width': '644', 'height': '322'}]","[{'type': 'text/plain', 'language': None, 'base': 'http://web.archive.org/web/20220112005228/https://www.lemonde.fr/disparitions/rss_full.xml', 'value': 'Igor Bogdanoff (à gauche) et son frère, Grichka Bogdanoff (à droite), assistent à la séance de photos du Jean-Paul Gaultier Fashion Freak Show au Théâtre des Folies-Bergère, à Paris, le 28\xa0septembre\xa02018.'}]","[{'scheme': 'urn:ebu', 'content': 'LUCAS BARIOULET / AFP'}]",LUCAS BARIOULET / AFP
Le célèbre paléontologue kényan Richard Leakey est mort,"{'type': 'text/plain', 'language': None, 'base': 'http://web.archive.org/web/20220112005228/https://www.lemonde.fr/disparitions/rss_full.xml', 'value': 'Le célèbre paléontologue kényan Richard Leakey est mort'}","Sun, 02 Jan 2022 20:19:08 +0100","time.struct_time(tm_year=2022, tm_mon=1, tm_mday=2, tm_hour=19, tm_min=19, tm_sec=8, tm_wday=6, tm_yday=2, tm_isdst=0)","En 1984, lors d’une prospection au lac Turkana, au Kenya, il avait mis au jour le squelette quasi complet du « garçon du Turkana », un « Homo erectus » de 1,63 mètre, mort il y a 1,5 million d’années.","{'type': 'text/html', 'language': None, 'base': 'http://web.archive.org/web/20220112005228/https://www.lemonde.fr/disparitions/rss_full.xml', 'value': 'En\xa01984, lors d’une prospection au lac Turkana, au Kenya, il avait mis au jour le squelette quasi complet du «\xa0garçon du Turkana\xa0», un «\xa0Homo erectus\xa0» de 1,63\xa0mètre, mort il y a 1,5\xa0million d’années.'}",https://www.lemonde.fr/disparitions/article/2022/01/02/le-celebre-paleontologue-kenyan-richard-leakey-est-mort_6107964_3382.html,True,https://www.lemonde.fr/disparitions/article/2022/01/02/le-celebre-paleontologue-kenyan-richard-leakey-est-mort_6107964_3382.html,"[{'rel': 'alternate', 'type': 'text/html', 'href': 'https://www.lemonde.fr/disparitions/article/2022/01/02/le-celebre-paleontologue-kenyan-richard-leakey-est-mort_6107964_3382.html'}]","[{'url': 'https://img.lemde.fr/2022/01/02/750/0/9000/4500/644/322/60/0/45caee7_5268736-01-06.jpg', 'width': '644', 'height': '322'}]","[{'type': 'text/plain', 'language': None, 'base': 'http://web.archive.org/web/20220112005228/https://www.lemonde.fr/disparitions/rss_full.xml', 'value': 'Richard Leakey, alors à la tête du\xa0Service de la faune du Kenya (KWS), en\xa02018.'}]","[{'scheme': 'urn:ebu', 'content': 'YASUYOSHI CHIBA / AFP'}]",YASUYOSHI CHIBA / AFP
"Aux obsèques de Desmond Tutu, l’hommage des Sud-Africains à leur dernier géant","{'type': 'text/plain', 'language': None, 'base': 'http://web.archive.org/web/20220112005228/https://www.lemonde.fr/disparitions/rss_full.xml', 'value': 'Aux obsèques de Desmond Tutu, l’hommage des Sud-Africains à leur dernier géant'}","Sun, 02 Jan 2022 02:28:43 +0100","time.struct_time(tm_year=2022, tm_mon=1, tm_mday=2, tm_hour=1, tm_min=28, tm_sec=43, tm_wday=6, tm_yday=2, tm_isdst=0)","Pour cause de pandémie, mais aussi pour respecter les dernières volontés du Prix Nobel de la paix, les funérailles se sont déroulées dans la simplicité au Cap. Le combattant de l’apartheid est mort le 26 décembre, à 90 ans.","{'type': 'text/html', 'language': None, 'base': 'http://web.archive.org/web/20220112005228/https://www.lemonde.fr/disparitions/rss_full.xml', 'value': 'Pour cause de pandémie, mais aussi pour respecter les dernières volontés du Prix Nobel de la paix, les funérailles se sont déroulées dans la simplicité au Cap. Le combattant de l’apartheid est mort le 26\xa0décembre, à 90\xa0ans.'}",https://www.lemonde.fr/afrique/article/2022/01/02/aux-obseques-de-desmond-tutu-l-hommage-des-sud-africains-a-leur-dernier-geant_6107915_3212.html,True,https://www.lemonde.fr/afrique/article/2022/01/02/aux-obseques-de-desmond-tutu-l-hommage-des-sud-africains-a-leur-dernier-geant_6107915_3212.html,"[{'rel': 'alternate', 'type': 'text/html', 'href': 'https://www.lemonde.fr/afrique/article/2022/01/02/aux-obseques-de-desmond-tutu-l-hommage-des-sud-africains-a-leur-dernier-geant_6107915_3212.html'}]","[{'url': 'https://img.lemde.fr/2022/01/01/482/0/3600/1800/644/322/60/0/7927bd6_b98ded4c5263416bbc4363138cb97254-b98ded4c5263416bbc4363138cb97254-0.jpg', 'width': '644', 'height': '322'}]","[{'type': 'text/plain', 'language': None, 'base': 'http://web.archive.org/web/20220112005228/https://www.lemonde.fr/disparitions/rss_full.xml', 'value': 'Le cercueil de Desmond Tutu, dans la cathédrale Saint-Georges, au Cap, en Afrique du Sud, le 1er janvier 2022.'}]","[{'scheme': 'urn:ebu', 'content': 'JACO MARAIS / AP'}]",JACO MARAIS / AP
L’actrice américaine Betty White est morte à l’âge de 99 ans,"{'type': 'text/plain', 'language': None, 'base': 'http://web.archive.org/web/20220112005228/https://www.lemonde.fr/disparitions/rss_full.xml', 'value': 'L’actrice américaine Betty White est morte à l’âge de 99\xa0ans'}","Fri, 31 Dec 2021 22:23:01 +0100","time.struct_time(tm_year=2021, tm_mon=12, tm_mday=31, tm_hour=21, tm_min=23, tm_sec=1, tm_wday=4, tm_yday=365, tm_isdst=0)","De 1985 à 1992, elle avait interprété la très lunaire Rose Nylund dans la série « Les Craquantes ». Elle aurait eu 100 ans le 17 janvier 2022.","{'type': 'text/html', 'language': None, 'base': 'http://web.archive.org/web/20220112005228/https://www.lemonde.fr/disparitions/rss_full.xml', 'value': 'De 1985 à 1992, elle avait interprété la très lunaire Rose Nylund dans la série «\xa0Les Craquantes\xa0». Elle aurait eu 100\xa0ans le 17\xa0janvier\xa02022.'}",https://www.lemonde.fr/disparitions/article/2021/12/31/l-actrice-americaine-betty-white-est-morte-a-l-age-de-99-ans_6107835_3382.html,True,https://www.lemonde.fr/disparitions/article/2021/12/31/l-actrice-americaine-betty-white-est-morte-a-l-age-de-99-ans_6107835_3382.html,"[{'rel': 'alternate', 'type': 'text/html', 'href': 'https://www.lemonde.fr/disparitions/article/2021/12/31/l-actrice-americaine-betty-white-est-morte-a-l-age-de-99-ans_6107835_3382.html'}]","[{'url': 'https://img.lemde.fr/2021/12/31/288/0/3500/1750/644/322/60/0/b4168c9_loa11-people-betty-white-0124-11.jpg', 'width': '644', 'height': '322'}]","[{'type': 'text/plain', 'language': None, 'base': 'http://web.archive.org/web/20220112005228/https://www.lemonde.fr/disparitions/rss_full.xml', 'value': 'L’actrice américaine Betty White, lors de la 16e\xa0cérémonie annuelle des Screen Actors Guild Awards, à Los Angeles, le 23\xa0janvier 2010.'}]","[{'scheme': 'urn:ebu', 'content': 'PHIL MCCARTEN / REUTERS'}]",PHIL MCCARTEN / REUTERS
